source,category,subcategory,title,link,description,pub_date,author,guid,full_content,pub_date_formatted,full_paragraphs
SCMP,news,hong_kong,Hong Kong police arrest 2 for allegedly practising as unlicensed dentists,https://www.scmp.com/news/hong-kong/law-and-crime/article/3306231/hong-kong-police-arrest-2-allegedly-practising-unlicensed-dentists?utm_source=rss_feed,"Undercover officers pose as customers in two separate cases, which are first to emerge since update to regulations earlier this year.","Fri, 11 Apr 2025 20:32:55 +0800",Ambrose Li,https://www.scmp.com/news/hong-kong/law-and-crime/article/3306231/hong-kong-police-arrest-2-allegedly-practising-unlicensed-dentists?utm_source=rss_feed,"Undercover officers pose as customers in two separate cases, which are first to emerge since update to regulations earlier this year.",2025-04-11 20:32:55,
SCMP,news,hong_kong,Hong Kong seeks to attract US-listed mainland firms amid trade war,https://www.scmp.com/news/hong-kong/politics/article/3306227/hong-kong-seeks-attract-us-listed-mainland-firms-amid-trade-war?utm_source=rss_feed,Innovation chief Sun Dong pledges to showcase city’s global appeal as he reveals several firms have already contacted the Hong Kong government.,"Fri, 11 Apr 2025 20:23:10 +0800",Harvey Kong,https://www.scmp.com/news/hong-kong/politics/article/3306227/hong-kong-seeks-attract-us-listed-mainland-firms-amid-trade-war?utm_source=rss_feed,Innovation chief Sun Dong pledges to showcase city’s global appeal as he reveals several firms have already contacted the Hong Kong government.,2025-04-11 20:23:10,
SCMP,news,hong_kong,Australia woman gives birth to stranger’s baby after IVF clinic error,https://www.scmp.com/news/asia/australasia/article/3306229/australia-woman-gives-birth-strangers-baby-after-ivf-clinic-error?utm_source=rss_feed,Staff at Brisbane’s Monash IVF discovered an embryo from another patient had been mistakenly thawed and transferred to the birth mother.,"Fri, 11 Apr 2025 20:18:29 +0800",Associated Press,https://www.scmp.com/news/asia/australasia/article/3306229/australia-woman-gives-birth-strangers-baby-after-ivf-clinic-error?utm_source=rss_feed,Staff at Brisbane’s Monash IVF discovered an embryo from another patient had been mistakenly thawed and transferred to the birth mother.,2025-04-11 20:18:29,
SCMP,news,hong_kong,Hong Kong to test flood scheme at 5 road sections hit by 2023 rainstorm chaos,https://www.scmp.com/news/hong-kong/society/article/3306224/hong-kong-test-flood-scheme-5-road-sections-hit-2023-rainstorm-chaos?utm_source=rss_feed,"Warning signs, wading lines and flood monitoring devices will be used at five low-lying road sections under pilot scheme.","Fri, 11 Apr 2025 20:06:04 +0800",Edith Lin,https://www.scmp.com/news/hong-kong/society/article/3306224/hong-kong-test-flood-scheme-5-road-sections-hit-2023-rainstorm-chaos?utm_source=rss_feed,"Warning signs, wading lines and flood monitoring devices will be used at five low-lying road sections under pilot scheme.",2025-04-11 20:06:04,
SCMP,business,companies,"Manchester United visit is nice, but India are the top priority for Hong Kong coach",https://www.scmp.com/sport/football/article/3306196/manchester-united-visit-nice-india-are-top-priority-hong-kong-coach?utm_source=rss_feed,"City’s representative team face Premier League side next month, but Asian Cup qualifier days later is the real prize for Ashley Westwood.","Fri, 11 Apr 2025 20:00:08 +0800",Paul McNamara,https://www.scmp.com/sport/football/article/3306196/manchester-united-visit-nice-india-are-top-priority-hong-kong-coach?utm_source=rss_feed,"City’s representative team face Premier League side next month, but Asian Cup qualifier days later is the real prize for Ashley Westwood.",2025-04-11 20:00:08,
SCMP,news,hong_kong,Chip war: China amends ‘place of origin’ in boost to local semiconductor manufacturers,https://www.scmp.com/tech/tech-war/article/3306220/chip-war-china-amends-place-origin-boost-local-semiconductor-manufacturers?utm_source=rss_feed,The China Semiconductor Industry Association said that the place of origin for chips is now determined by the location of the wafer fabrication plant.,"Fri, 11 Apr 2025 20:00:04 +0800",Wency Chen,https://www.scmp.com/tech/tech-war/article/3306220/chip-war-china-amends-place-origin-boost-local-semiconductor-manufacturers?utm_source=rss_feed,The China Semiconductor Industry Association said that the place of origin for chips is now determined by the location of the wafer fabrication plant.,2025-04-11 20:00:04,
SCMP,news,hong_kong,US fires fresh broadside at China’s shipyards with new executive order,https://www.scmp.com/economy/china-economy/article/3306177/us-fires-fresh-broadside-chinas-shipyards-new-executive-order?utm_source=rss_feed,"The US has softened a controversial port-fee proposal, but is preparing yet more tariffs targeting China’s dominant shipbuilding sector.","Fri, 11 Apr 2025 19:30:07 +0800",Carol Yang,https://www.scmp.com/economy/china-economy/article/3306177/us-fires-fresh-broadside-chinas-shipyards-new-executive-order?utm_source=rss_feed,"The US has softened a controversial port-fee proposal, but is preparing yet more tariffs targeting China’s dominant shipbuilding sector.",2025-04-11 19:30:07,
SCMP,news,hong_kong,"As Trump has annual check-up, will he finally share details of his health?",https://www.scmp.com/news/world/united-states-canada/article/3306210/trump-has-annual-check-will-he-finally-share-details-his-health?utm_source=rss_feed,The nation’s oldest president to be sworn into office has long kept basic facts about his health shrouded in secrecy.,"Fri, 11 Apr 2025 19:16:08 +0800",Associated Press,https://www.scmp.com/news/world/united-states-canada/article/3306210/trump-has-annual-check-will-he-finally-share-details-his-health?utm_source=rss_feed,The nation’s oldest president to be sworn into office has long kept basic facts about his health shrouded in secrecy.,2025-04-11 19:16:08,
SCMP,business,global_economy,Cartier show at London’s V&A features 350 jewellery pieces worn by royalty and Hollywood,https://www.scmp.com/lifestyle/fashion-beauty/article/3305935/cartier-show-londons-va-features-350-jewellery-pieces-worn-royalty-and-hollywood?utm_source=rss_feed,"Exhibition at London’s V&A explores Cartier luxury jewellery, watches and tiaras, with creations spanning decades of elegance and innovation.","Fri, 11 Apr 2025 19:15:08 +0800",Reuters,https://www.scmp.com/lifestyle/fashion-beauty/article/3305935/cartier-show-londons-va-features-350-jewellery-pieces-worn-royalty-and-hollywood?utm_source=rss_feed,"Exhibition at London’s V&A explores Cartier luxury jewellery, watches and tiaras, with creations spanning decades of elegance and innovation.",2025-04-11 19:15:08,
SCMP,news,hong_kong,Siobhan Haughey’s Olympic swimsuit sells at auction for more than Phelps’ Speedos,https://www.scmp.com/sport/hong-kong/article/3306208/siobhan-haugheys-olympic-swimsuit-sells-auction-more-phelps-speedos?utm_source=rss_feed,"HK$180,000 bid buys Arena swimsuit and team cap Haughey wore to earn Hong Kong’s first Olympic medal in swimming.","Fri, 11 Apr 2025 19:04:59 +0800",Tom Bell,https://www.scmp.com/sport/hong-kong/article/3306208/siobhan-haugheys-olympic-swimsuit-sells-auction-more-phelps-speedos?utm_source=rss_feed,"HK$180,000 bid buys Arena swimsuit and team cap Haughey wore to earn Hong Kong’s first Olympic medal in swimming.",2025-04-11 19:04:59,
SCMP,news,hong_kong,"‘Protect not punish’ whistle-blowers, Malaysian corruption watchdog urges",https://www.scmp.com/week-asia/politics/article/3306207/protect-not-punish-whistle-blowers-malaysian-corruption-watchdog-urges?utm_source=rss_feed,"A businessman who exposed alleged corruption is now facing scrutiny himself, raising questions about Malaysia’s anti-graft legal framework.","Fri, 11 Apr 2025 19:02:29 +0800",Aidan Jones,https://www.scmp.com/week-asia/politics/article/3306207/protect-not-punish-whistle-blowers-malaysian-corruption-watchdog-urges?utm_source=rss_feed,"A businessman who exposed alleged corruption is now facing scrutiny himself, raising questions about Malaysia’s anti-graft legal framework.",2025-04-11 19:02:29,
SCMP,news,hong_kong,Philippines denies health scare after Marcos appears to have bleeding gums in viral video,https://www.scmp.com/week-asia/politics/article/3306206/philippines-denies-health-scare-after-marcos-appears-have-bleeding-gums-viral-video?utm_source=rss_feed,Speculation about the president’s health was fuelled by footage of Marcos speaking with what looked like blood in his mouth during a speech.,"Fri, 11 Apr 2025 19:00:52 +0800",Raissa Robles,https://www.scmp.com/week-asia/politics/article/3306206/philippines-denies-health-scare-after-marcos-appears-have-bleeding-gums-viral-video?utm_source=rss_feed,Speculation about the president’s health was fuelled by footage of Marcos speaking with what looked like blood in his mouth during a speech.,2025-04-11 19:00:52,
SCMP,business,business,Delisting of US-listed Chinese firms to boost Hong Kong’s status as fundraising hub,https://www.scmp.com/business/markets/article/3306203/delisting-us-listed-chinese-firms-boost-hong-kongs-status-fundraising-hub?utm_source=rss_feed,A total of 286 Chinese firms are listed in the US with a total market capitalisation of US$1.1 trillion.,"Fri, 11 Apr 2025 18:51:44 +0800","Enoch Yiu,Cao Li",https://www.scmp.com/business/markets/article/3306203/delisting-us-listed-chinese-firms-boost-hong-kongs-status-fundraising-hub?utm_source=rss_feed,A total of 286 Chinese firms are listed in the US with a total market capitalisation of US$1.1 trillion.,2025-04-11 18:51:44,
SCMP,news,hong_kong,"India speeds up UK, EU trade deals to buffer against Trump’s tariffs",https://www.scmp.com/week-asia/economics/article/3306165/india-speeds-uk-eu-trade-deals-buffer-against-trumps-tariffs?utm_source=rss_feed,Analysts warn of potential ‘winners and losers’ if deals are rushed – though 90 per cent of the UK deal is already reportedly done.,"Fri, 11 Apr 2025 18:30:07 +0800",Biman Mukherji,https://www.scmp.com/week-asia/economics/article/3306165/india-speeds-uk-eu-trade-deals-buffer-against-trumps-tariffs?utm_source=rss_feed,Analysts warn of potential ‘winners and losers’ if deals are rushed – though 90 per cent of the UK deal is already reportedly done.,2025-04-11 18:30:07,
SCMP,news,hong_kong,US tariffs impact on developing countries could be worse than foreign aid cuts: UN,https://www.scmp.com/news/world/united-states-canada/article/3306198/us-tariffs-impact-developing-countries-could-be-worse-foreign-aid-cuts-un?utm_source=rss_feed,"Tariffs on imports to the US mean developing economies risk sliding back on gains made in recent years, says the United Nations’ trade agency.","Fri, 11 Apr 2025 18:21:57 +0800",Reuters,https://www.scmp.com/news/world/united-states-canada/article/3306198/us-tariffs-impact-developing-countries-could-be-worse-foreign-aid-cuts-un?utm_source=rss_feed,"Tariffs on imports to the US mean developing economies risk sliding back on gains made in recent years, says the United Nations’ trade agency.",2025-04-11 18:21:57,
SCMP,business,global_economy,"How Hong Kong actress Carman Lee found fame in Condor Heroes on TV, then gave it all up",https://www.scmp.com/lifestyle/entertainment/article/3306166/how-hong-kong-actress-carman-lee-found-fame-condor-heroes-tv-then-gave-it-all?utm_source=rss_feed,"Actress got her big break in a Hong Kong TV adaptation of a Louis Cha wuxia novel, shone in a variety of roles, then quit acting.","Fri, 11 Apr 2025 18:15:08 +0800",Lisa Cam,https://www.scmp.com/lifestyle/entertainment/article/3306166/how-hong-kong-actress-carman-lee-found-fame-condor-heroes-tv-then-gave-it-all?utm_source=rss_feed,"Actress got her big break in a Hong Kong TV adaptation of a Louis Cha wuxia novel, shone in a variety of roles, then quit acting.",2025-04-11 18:15:08,
SCMP,news,hong_kong,Chinese AI firm SenseTime bets on multimodal models to stand out from rivals,https://www.scmp.com/tech/big-tech/article/3306164/chinese-ai-firm-sensetime-bets-multimodal-models-stand-out-rivals?utm_source=rss_feed,"Its latest SenseNova V6 and V6 Reasoner models have outperformed competing products from OpenAI, CEO Xu Li says.","Fri, 11 Apr 2025 18:00:27 +0800",Ann Cao,https://www.scmp.com/tech/big-tech/article/3306164/chinese-ai-firm-sensetime-bets-multimodal-models-stand-out-rivals?utm_source=rss_feed,"Its latest SenseNova V6 and V6 Reasoner models have outperformed competing products from OpenAI, CEO Xu Li says.",2025-04-11 18:00:27,
SCMP,news,hong_kong,Chinese car owner seeks only pancakes in compensation after food cart scratches vehicle,https://www.scmp.com/news/people-culture/trending-china/article/3305676/chinese-car-owner-seeks-only-pancakes-compensation-after-food-cart-scratches-vehicle?utm_source=rss_feed,"Couple responsible for damage to Range Rover cannot afford US$410 repair bill, vehicle owner accepts offer of street food instead.","Fri, 11 Apr 2025 18:00:16 +0800",Yating Yang,https://www.scmp.com/news/people-culture/trending-china/article/3305676/chinese-car-owner-seeks-only-pancakes-compensation-after-food-cart-scratches-vehicle?utm_source=rss_feed,"Couple responsible for damage to Range Rover cannot afford US$410 repair bill, vehicle owner accepts offer of street food instead.",2025-04-11 18:00:16,
SCMP,news,hong_kong,Philippine politician’s remarks spark misogyny row,https://www.scmp.com/news/asia/southeast-asia/article/3306225/philippine-politicians-remarks-spark-misogyny-row?utm_source=rss_feed,Christian Sia’s remarks have been called a potential test case for curbing misogyny on the campaign trail.,"Fri, 11 Apr 2025 18:00:00 +0800",Raissa Robles,https://www.scmp.com/news/asia/southeast-asia/article/3306225/philippine-politicians-remarks-spark-misogyny-row?utm_source=rss_feed,Christian Sia’s remarks have been called a potential test case for curbing misogyny on the campaign trail.,2025-04-11 18:00:00,
SCMP,news,hong_kong,"Chinese netizens air anger, patriotism and anti-American views amid tariff war",https://www.scmp.com/news/china/politics/article/3306193/chinese-netizens-air-anger-old-school-patriotism-and-anti-american-views-amid-tariff-war?utm_source=rss_feed,Video clips of Mao Zedong and nationalistic films are circulating as Chinese citizens and business owners consider fallout from Trump’s tariffs.,"Fri, 11 Apr 2025 17:59:29 +0800","Vanessa Cai,William Zheng",https://www.scmp.com/news/china/politics/article/3306193/chinese-netizens-air-anger-old-school-patriotism-and-anti-american-views-amid-tariff-war?utm_source=rss_feed,Video clips of Mao Zedong and nationalistic films are circulating as Chinese citizens and business owners consider fallout from Trump’s tariffs.,2025-04-11 17:59:29,
SCMP,news,hong_kong,Japan Post worker arrested for mailing used condom to colleague ‘to satisfy sexual urges’,https://www.scmp.com/week-asia/lifestyle-culture/article/3306194/japan-post-worker-arrested-mailing-used-condom-colleague-satisfy-sexual-urges?utm_source=rss_feed,The incident has sparked safety concerns and an investigation into similar cases.,"Fri, 11 Apr 2025 17:56:43 +0800",SCMP’s Asia desk,https://www.scmp.com/week-asia/lifestyle-culture/article/3306194/japan-post-worker-arrested-mailing-used-condom-colleague-satisfy-sexual-urges?utm_source=rss_feed,The incident has sparked safety concerns and an investigation into similar cases.,2025-04-11 17:56:43,
SCMP,business,business,"Chagee, Miniso play down US delisting concerns amid Trump tariff war",https://www.scmp.com/business/markets/article/3306189/chagee-miniso-play-down-us-delisting-concerns-amid-trump-tariff-war?utm_source=rss_feed,"Any delisting move may benefit the stock exchange and deal bankers in Hong Kong, CreditSights says.","Fri, 11 Apr 2025 17:48:57 +0800",Yuke Xie,https://www.scmp.com/business/markets/article/3306189/chagee-miniso-play-down-us-delisting-concerns-amid-trump-tariff-war?utm_source=rss_feed,"Any delisting move may benefit the stock exchange and deal bankers in Hong Kong, CreditSights says.",2025-04-11 17:48:57,
SCMP,news,hong_kong,How Japan built a 3D-printed railway station overnight,https://www.scmp.com/news/asia/east-asia/article/3306169/how-japan-built-3d-printed-railway-station-overnight?utm_source=rss_feed,Assembly process began at midnight and was finished about five hours later.,"Fri, 11 Apr 2025 17:30:15 +0800",Caroline Qiqige Wang,https://www.scmp.com/news/asia/east-asia/article/3306169/how-japan-built-3d-printed-railway-station-overnight?utm_source=rss_feed,Assembly process began at midnight and was finished about five hours later.,2025-04-11 17:30:15,
SCMP,business,companies,"Miami upset shows Hong Kong tennis belongs, but I must conquer clay: Coleman Wong",https://www.scmp.com/sport/hong-kong/article/3306154/miami-upset-shows-hong-kong-tennis-belongs-i-must-conquer-clay-coleman-wong?utm_source=rss_feed,"City’s highest-ranked player hopes to continue recent breakthrough form in clay-court season, starting with wild card at Madrid Open.","Fri, 11 Apr 2025 17:30:13 +0800",Lars Hamer,https://www.scmp.com/sport/hong-kong/article/3306154/miami-upset-shows-hong-kong-tennis-belongs-i-must-conquer-clay-coleman-wong?utm_source=rss_feed,"City’s highest-ranked player hopes to continue recent breakthrough form in clay-court season, starting with wild card at Madrid Open.",2025-04-11 17:30:13,
SCMP,news,hong_kong,Golden retriever in China stops rolling baby stroller,https://www.scmp.com/news/china/article/3306147/golden-retriever-china-stops-rolling-baby-stroller?utm_source=rss_feed,"The dog has always been helpful, the child’s mother says.","Fri, 11 Apr 2025 17:30:08 +0800",Sammi Chan,https://www.scmp.com/news/china/article/3306147/golden-retriever-china-stops-rolling-baby-stroller?utm_source=rss_feed,"The dog has always been helpful, the child’s mother says.",2025-04-11 17:30:08,
SCMP,news,hong_kong,"US$5.1 billion in cuts, including on climate change, announced by Pentagon",https://www.scmp.com/news/world/united-states-canada/article/3306179/us51-billion-cuts-including-climate-change-announced-pentagon?utm_source=rss_feed,"Department of Defence boss Pete Hegseth said climate change, Covid-19 response and diversity programmes will be among the contracts to end.","Fri, 11 Apr 2025 17:22:51 +0800",Agence France-Presse,https://www.scmp.com/news/world/united-states-canada/article/3306179/us51-billion-cuts-including-climate-change-announced-pentagon?utm_source=rss_feed,"Department of Defence boss Pete Hegseth said climate change, Covid-19 response and diversity programmes will be among the contracts to end.",2025-04-11 17:22:51,
SCMP,business,global_economy,"5 of the best things to do in Hong Kong this weekend, April 11-13",https://www.scmp.com/lifestyle/health-wellness/article/3306123/5-best-things-do-hong-kong-weekend-april-11-13?utm_source=rss_feed,"Quaff some Pharrell Williams champagne, learn how to care better for your dog, revisit an iconic Hong Kong movie and more this weekend.","Fri, 11 Apr 2025 17:15:07 +0800",SCMP Reporter,https://www.scmp.com/lifestyle/health-wellness/article/3306123/5-best-things-do-hong-kong-weekend-april-11-13?utm_source=rss_feed,"Quaff some Pharrell Williams champagne, learn how to care better for your dog, revisit an iconic Hong Kong movie and more this weekend.",2025-04-11 17:15:07,
SCMP,news,hong_kong,"Ex-Hong Kong policeman charged in ICAC probe faces 30 extra counts of bribery, fraud",https://www.scmp.com/news/hong-kong/law-and-crime/article/3306170/ex-hong-kong-policeman-charged-icac-probe-faces-30-extra-counts-bribery-fraud?utm_source=rss_feed,Extra charges against Mak Kwok-hung include accepting an advantage as a public servant and 28 counts of fraud.,"Fri, 11 Apr 2025 17:06:28 +0800",Ng Kang-chung,https://www.scmp.com/news/hong-kong/law-and-crime/article/3306170/ex-hong-kong-policeman-charged-icac-probe-faces-30-extra-counts-bribery-fraud?utm_source=rss_feed,Extra charges against Mak Kwok-hung include accepting an advantage as a public servant and 28 counts of fraud.,2025-04-11 17:06:28,
SCMP,business,business,TikTok owner ByteDance’s overseas sales jump in 2024 despite US hurdles: report,https://www.scmp.com/tech/big-tech/article/3306161/tiktok-owner-bytedances-overseas-sales-jump-2024-despite-us-hurdles-report?utm_source=rss_feed,"ByteDance’s total revenue is said to have risen to US$155 billion last year, placing the unicorn among the world’s top internet giants.","Fri, 11 Apr 2025 17:00:14 +0800",Ben Jiang,https://www.scmp.com/tech/big-tech/article/3306161/tiktok-owner-bytedances-overseas-sales-jump-2024-despite-us-hurdles-report?utm_source=rss_feed,"ByteDance’s total revenue is said to have risen to US$155 billion last year, placing the unicorn among the world’s top internet giants.",2025-04-11 17:00:14,
SCMP,news,hong_kong,South China Sea: Philippines’ resupply mission successful but is it calm before the storm?,https://www.scmp.com/week-asia/politics/article/3306127/south-china-sea-philippines-resupply-mission-successful-it-calm-storm?utm_source=rss_feed,"Seventh trouble-free mission to disputed Second Thomas Shoal could be due to the July 2024 arrangement between both sides, analysts note.","Fri, 11 Apr 2025 17:00:10 +0800",Jeoffrey Maitem,https://www.scmp.com/week-asia/politics/article/3306127/south-china-sea-philippines-resupply-mission-successful-it-calm-storm?utm_source=rss_feed,"Seventh trouble-free mission to disputed Second Thomas Shoal could be due to the July 2024 arrangement between both sides, analysts note.",2025-04-11 17:00:10,
SCMP,news,hong_kong,"In South Korea, digital sex crimes soar amid rise in AI, deepfake technology",https://www.scmp.com/week-asia/lifestyle-culture/article/3306158/south-korea-digital-sex-crimes-soar-amid-rise-ai-deepfake-technology?utm_source=rss_feed,Support centre for victims notes disturbing trend of young people using AI-generated deepfake images for entertainment.,"Fri, 11 Apr 2025 16:30:40 +0800",SCMP’s Asia desk,https://www.scmp.com/week-asia/lifestyle-culture/article/3306158/south-korea-digital-sex-crimes-soar-amid-rise-ai-deepfake-technology?utm_source=rss_feed,Support centre for victims notes disturbing trend of young people using AI-generated deepfake images for entertainment.,2025-04-11 16:30:40,
SCMP,news,hong_kong,Chinese brands are impressing the world – but can they inspire it?,https://www.scmp.com/opinion/china-opinion/article/3305830/chinese-brands-are-impressing-world-can-they-inspire-it?utm_source=rss_feed,"While Chinese companies excel in quality, pricing and design, some have yet to embed themselves in the emotional lives of global consumers.","Fri, 11 Apr 2025 16:30:07 +0800",Samer Elhajjar,https://www.scmp.com/opinion/china-opinion/article/3305830/chinese-brands-are-impressing-world-can-they-inspire-it?utm_source=rss_feed,"While Chinese companies excel in quality, pricing and design, some have yet to embed themselves in the emotional lives of global consumers.",2025-04-11 16:30:07,
SCMP,business,global_economy,Is this AI-powered gym the future of fitness? Personalised workouts created by a Genius,https://www.scmp.com/lifestyle/health-wellness/article/3305798/ai-powered-gym-future-fitness-personalised-workouts-created-genius?utm_source=rss_feed,"The ‘first full-scale AI-powered gym’ in LA pairs AI software with human coaches to keep you on track – so be good, for goodness’ sake.","Fri, 11 Apr 2025 16:15:08 +0800",Tribune News Service,https://www.scmp.com/lifestyle/health-wellness/article/3305798/ai-powered-gym-future-fitness-personalised-workouts-created-genius?utm_source=rss_feed,"The ‘first full-scale AI-powered gym’ in LA pairs AI software with human coaches to keep you on track – so be good, for goodness’ sake.",2025-04-11 16:15:08,
SCMP,news,hong_kong,"China ups tariffs on American goods to 125%, will ‘ignore’ future US hikes",https://www.scmp.com/economy/china-economy/article/3306151/china-raises-tariffs-us-goods-125?utm_source=rss_feed,"Latest move matches tariff level announced by US President Donald Trump, and officials say any future US increases will not be met with reply.","Fri, 11 Apr 2025 16:09:12 +0800","Ji Siqi,Frank Chen",https://www.scmp.com/economy/china-economy/article/3306151/china-raises-tariffs-us-goods-125?utm_source=rss_feed,"Latest move matches tariff level announced by US President Donald Trump, and officials say any future US increases will not be met with reply.",2025-04-11 16:09:12,
SCMP,news,hong_kong,Volatile market prompts Chinese retail investors to demand details of firms’ US exposure,https://www.scmp.com/economy/china-economy/article/3306145/volatile-market-prompts-chinese-retail-investors-demand-details-firms-us-exposure?utm_source=rss_feed,China’s more than 100 million retail investors have seen the A-share market shed about 4.5 trillion yuan of value this month.,"Fri, 11 Apr 2025 16:00:16 +0800",Sylvia Ma,https://www.scmp.com/economy/china-economy/article/3306145/volatile-market-prompts-chinese-retail-investors-demand-details-firms-us-exposure?utm_source=rss_feed,China’s more than 100 million retail investors have seen the A-share market shed about 4.5 trillion yuan of value this month.,2025-04-11 16:00:16,
