source,category,subcategory,title,link,description,pub_date,author,guid,full_content,pub_date_formatted,full_paragraphs
SCMP,business,companies,National Games: Hong Kong cycling coach targets repeat of 4-medal haul in November,https://www.scmp.com/sport/hong-kong/article/3305282/national-games-hong-kong-cycling-coach-targets-repeat-4-medal-haul-november?utm_source=rss_feed,"Herve Dagorne warns that competition will be tough, with some athletes considering the Games ‘even more important than the Olympics’.","Fri, 04 Apr 2025 21:00:16 +0800",Mike Chan,https://www.scmp.com/sport/hong-kong/article/3305282/national-games-hong-kong-cycling-coach-targets-repeat-4-medal-haul-november?utm_source=rss_feed,"Herve Dagorne warns that competition will be tough, with some athletes considering the Games ‘even more important than the Olympics’.",2025-04-04 21:00:16,
SCMP,news,asia,Malaysia’s electronics sector at risk as experts call out Trump’s ‘voodoo’ tariffs,https://www.scmp.com/week-asia/economics/article/3305278/malaysias-electronics-sector-risk-experts-call-out-trumps-voodoo-tariffs?utm_source=rss_feed,Analysts say Washington’s semiconductor exemption offers little relief as Malaysia’s broader electronics industry face steep import levies.,"Fri, 04 Apr 2025 20:49:30 +0800",Joseph Sipalan,https://www.scmp.com/week-asia/economics/article/3305278/malaysias-electronics-sector-risk-experts-call-out-trumps-voodoo-tariffs?utm_source=rss_feed,Analysts say Washington’s semiconductor exemption offers little relief as Malaysia’s broader electronics industry face steep import levies.,2025-04-04 20:49:30,
SCMP,news,asia,South Korea’s Jeju unsettled by rise in crime as Chinese tourists return in droves,https://www.scmp.com/week-asia/lifestyle-culture/article/3305292/south-koreas-jeju-unsettled-rise-crime-chinese-tourists-return-droves?utm_source=rss_feed,Official data shows Chinese visitors accounted for 66 per cent of foreign crimes between 2019 and 2023 67 per cent in 2023 alone.,"Fri, 04 Apr 2025 20:40:58 +0800",SCMP’s Asia desk,https://www.scmp.com/week-asia/lifestyle-culture/article/3305292/south-koreas-jeju-unsettled-rise-crime-chinese-tourists-return-droves?utm_source=rss_feed,Official data shows Chinese visitors accounted for 66 per cent of foreign crimes between 2019 and 2023 67 per cent in 2023 alone.,2025-04-04 20:40:58,
SCMP,news,world,Hong Kong police arrest 4 from Guangxi over string of luxury home burglaries,https://www.scmp.com/news/hong-kong/law-and-crime/article/3305291/hong-kong-police-arrest-4-guangxi-over-string-luxury-home-burglaries?utm_source=rss_feed,"Jewellery, watches and cash worth HK$375,000 stolen from homes in Pok Fu Lam, Sai Kung, Tung Chung and Ma Wan.","Fri, 04 Apr 2025 20:40:10 +0800",Emily Hung,https://www.scmp.com/news/hong-kong/law-and-crime/article/3305291/hong-kong-police-arrest-4-guangxi-over-string-luxury-home-burglaries?utm_source=rss_feed,"Jewellery, watches and cash worth HK$375,000 stolen from homes in Pok Fu Lam, Sai Kung, Tung Chung and Ma Wan.",2025-04-04 20:40:10,
SCMP,news,asia,3 ways Asean can survive Trump’s tariff war – and 4 ways China can help,https://www.scmp.com/opinion/asia-opinion/article/3305031/3-ways-asean-can-survive-trumps-tariff-war-and-4-ways-china-can-help?utm_source=rss_feed,"Amid escalating global trade tensions, Southeast Asian nations must stick together and diversify their options to mitigate external shocks.","Fri, 04 Apr 2025 20:30:09 +0800",Jianlu Bi,https://www.scmp.com/opinion/asia-opinion/article/3305031/3-ways-asean-can-survive-trumps-tariff-war-and-4-ways-china-can-help?utm_source=rss_feed,"Amid escalating global trade tensions, Southeast Asian nations must stick together and diversify their options to mitigate external shocks.",2025-04-04 20:30:09,
SCMP,news,world,Hong Kong customs aims to fully launch tobacco laser labels by June 2027,https://www.scmp.com/news/hong-kong/law-and-crime/article/3305287/hong-kong-customs-aim-fully-launch-tobacco-laser-labels-june-2027?utm_source=rss_feed,"Customs chief Chan Tsz-tat says exact launch date to depend on how much time is needed to amend the relevant laws, among other factors.","Fri, 04 Apr 2025 20:06:51 +0800",Jess Ma,https://www.scmp.com/news/hong-kong/law-and-crime/article/3305287/hong-kong-customs-aim-fully-launch-tobacco-laser-labels-june-2027?utm_source=rss_feed,"Customs chief Chan Tsz-tat says exact launch date to depend on how much time is needed to amend the relevant laws, among other factors.",2025-04-04 20:06:51,
SCMP,news,world,How will Hong Kong businesses brace for impact as US-China tariff war escalates?,https://www.scmp.com/news/hong-kong/hong-kong-economy/article/3305283/how-will-hong-kong-businesses-brace-impact-us-china-tariff-war-escalates?utm_source=rss_feed,The Post looks at sectors that will be affected most as exports worth billions face vastly higher duties.,"Fri, 04 Apr 2025 19:56:18 +0800",Ambrose Li,https://www.scmp.com/news/hong-kong/hong-kong-economy/article/3305283/how-will-hong-kong-businesses-brace-impact-us-china-tariff-war-escalates?utm_source=rss_feed,The Post looks at sectors that will be affected most as exports worth billions face vastly higher duties.,2025-04-04 19:56:18,
SCMP,business,china_economy,"Trump losing patience with Putin, US’ Marco Rubio tells Nato",https://www.scmp.com/news/world/united-states-canada/article/3305284/trump-losing-patience-putin-us-marco-rubio-tells-nato?utm_source=rss_feed,US Secretary of State Marco Rubio said Trump probably wouldn’t accept the Russian president’s delaying tactics much longer.,"Fri, 04 Apr 2025 19:52:29 +0800",dpa,https://www.scmp.com/news/world/united-states-canada/article/3305284/trump-losing-patience-putin-us-marco-rubio-tells-nato?utm_source=rss_feed,US Secretary of State Marco Rubio said Trump probably wouldn’t accept the Russian president’s delaying tactics much longer.,2025-04-04 19:52:29,
SCMP,news,asia,"Indonesia’s new coal pricing rule sparks uncertainty, resistance from Chinese firms",https://www.scmp.com/week-asia/economics/article/3305277/indonesias-new-coal-pricing-rule-sparks-uncertainty-resistance-chinese-firms?utm_source=rss_feed,Analysts warn Indonesia may lose its competitiveness over the new regulation amid concerns about lack of market flexibility.,"Fri, 04 Apr 2025 19:03:43 +0800",Amy Sood,https://www.scmp.com/week-asia/economics/article/3305277/indonesias-new-coal-pricing-rule-sparks-uncertainty-resistance-chinese-firms?utm_source=rss_feed,Analysts warn Indonesia may lose its competitiveness over the new regulation amid concerns about lack of market flexibility.,2025-04-04 19:03:43,
SCMP,news,china,World’s first 1-nanometre RISC-V chip made in China with 2D materials,https://www.scmp.com/news/china/science/article/3305185/worlds-first-1-nanometre-risc-v-chip-made-china-2d-materials?utm_source=rss_feed,China’s chip industry has reached a major milestone after scientists developed the world’s most complex semiconductor microprocessor.,"Fri, 04 Apr 2025 19:00:10 +0800",Zhang Tong,https://www.scmp.com/news/china/science/article/3305185/worlds-first-1-nanometre-risc-v-chip-made-china-2d-materials?utm_source=rss_feed,China’s chip industry has reached a major milestone after scientists developed the world’s most complex semiconductor microprocessor.,2025-04-04 19:00:10,
SCMP,news,asia,‘Limits’ to Filipino hospitality: Russian vlogger arrested over harassment,https://www.scmp.com/week-asia/people/article/3305271/limits-filipino-hospitality-russian-vlogger-arrested-over-harassment?utm_source=rss_feed,"Vitaly Zdorovetskiy, 33, faces a litany of complaints lodged against him, after he filmed himself verbally abusing locals and causing a nuisance.","Fri, 04 Apr 2025 18:48:32 +0800",SCMP’s Asia desk,https://www.scmp.com/week-asia/people/article/3305271/limits-filipino-hospitality-russian-vlogger-arrested-over-harassment?utm_source=rss_feed,"Vitaly Zdorovetskiy, 33, faces a litany of complaints lodged against him, after he filmed himself verbally abusing locals and causing a nuisance.",2025-04-04 18:48:32,
SCMP,news,asia,"Ahead of Trump’s tariffs, most MNCs in Singapore worry about slowdown: survey",https://www.scmp.com/week-asia/economics/article/3305263/ahead-trumps-tariffs-most-mncs-singapore-worry-about-slowdown-survey?utm_source=rss_feed,"The survey by AmChamSG, conducted before Trump’s 10 per cent universal tariff move, reveals fears over rising costs and supply disruptions.","Fri, 04 Apr 2025 18:44:16 +0800",Kimberly Lim,https://www.scmp.com/week-asia/economics/article/3305263/ahead-trumps-tariffs-most-mncs-singapore-worry-about-slowdown-survey?utm_source=rss_feed,"The survey by AmChamSG, conducted before Trump’s 10 per cent universal tariff move, reveals fears over rising costs and supply disruptions.",2025-04-04 18:44:16,
SCMP,business,global_economy,Why are monkeys better at yodelling than humans? It’s all in the membrane,https://www.scmp.com/lifestyle/arts/article/3305180/why-are-monkeys-better-yodelling-humans-its-all-membrane?utm_source=rss_feed,"Human yodellers can switch up and down an octave, but monkeys have a 3½-octave range. Researchers have just discovered why that is.","Fri, 04 Apr 2025 18:15:27 +0800",Agence France-Presse,https://www.scmp.com/lifestyle/arts/article/3305180/why-are-monkeys-better-yodelling-humans-its-all-membrane?utm_source=rss_feed,"Human yodellers can switch up and down an octave, but monkeys have a 3½-octave range. Researchers have just discovered why that is.",2025-04-04 18:15:27,
SCMP,news,china,China hits back at US with 34% tariff on American imports in retaliation for Trump’s levies,https://www.scmp.com/economy/china-economy/article/3305260/china-hits-back-us-34-tariff-american-imports-retaliation-trumps-move?utm_source=rss_feed,The tariff comes into effect on April 10 and is part of a raft of measures that includes more rare earths controls.,"Fri, 04 Apr 2025 18:13:51 +0800","Holly Chik,Liu Zhen,Mia Nulimaimaiti,Josephine Ma",https://www.scmp.com/economy/china-economy/article/3305260/china-hits-back-us-34-tariff-american-imports-retaliation-trumps-move?utm_source=rss_feed,The tariff comes into effect on April 10 and is part of a raft of measures that includes more rare earths controls.,2025-04-04 18:13:51,
SCMP,news,china,"China e-commerce vendors scramble to respond to Trump tariffs, ‘de minimis’ exemption end",https://www.scmp.com/tech/tech-trends/article/3305256/china-e-commerce-vendors-scramble-respond-trump-tariffs-de-minimis-exemption-end?utm_source=rss_feed,"The policy changes affect many of China’s 120,000 online exporters, whose major market is the United States.","Fri, 04 Apr 2025 18:00:07 +0800","Wency Chen,Coco Feng",https://www.scmp.com/tech/tech-trends/article/3305256/china-e-commerce-vendors-scramble-respond-trump-tariffs-de-minimis-exemption-end?utm_source=rss_feed,"The policy changes affect many of China’s 120,000 online exporters, whose major market is the United States.",2025-04-04 18:00:07,
SCMP,business,china_economy,"Israel kills Hamas commander in Lebanon, further testing ceasefire",https://www.scmp.com/news/world/middle-east/article/3305257/israel-kills-hamas-commander-lebanon-further-testing-ceasefire?utm_source=rss_feed,Israel said the targeted militant Hassan Farhat was behind a rocket attack on the city of Safed last year that killed Israeli soldiers.,"Fri, 04 Apr 2025 17:47:29 +0800",Reuters,https://www.scmp.com/news/world/middle-east/article/3305257/israel-kills-hamas-commander-lebanon-further-testing-ceasefire?utm_source=rss_feed,Israel said the targeted militant Hassan Farhat was behind a rocket attack on the city of Safed last year that killed Israeli soldiers.,2025-04-04 17:47:29,
SCMP,news,china,Chinese mountain to get escalators for ‘painless climbing experience’,https://www.scmp.com/news/china/article/3305241/chinese-mountain-get-escalators-painless-climbing-experience?utm_source=rss_feed,Each escalator is about 50 metres long.,"Fri, 04 Apr 2025 17:45:08 +0800",Sammi Chan,https://www.scmp.com/news/china/article/3305241/chinese-mountain-get-escalators-painless-climbing-experience?utm_source=rss_feed,Each escalator is about 50 metres long.,2025-04-04 17:45:08,
SCMP,business,china_economy,Trump presents US$5 million ‘Gold Card’ for rich immigrants to US,https://www.scmp.com/news/world/united-states-canada/article/3305254/trump-presents-gold-card-rich-immigrants-us?utm_source=rss_feed,New card is aimed at wealthy people and others who are prepared to pay a big price for a US visa.,"Fri, 04 Apr 2025 17:32:16 +0800",dpa,https://www.scmp.com/news/world/united-states-canada/article/3305254/trump-presents-gold-card-rich-immigrants-us?utm_source=rss_feed,New card is aimed at wealthy people and others who are prepared to pay a big price for a US visa.,2025-04-04 17:32:16,
SCMP,business,china_economy,"Trump’s tariffs hit allies and rivals, but Russia, Cuba and North Korea escape penalties",https://www.scmp.com/news/world/united-states-canada/article/3305253/trumps-tariffs-hit-allies-and-rivals-russia-cuba-and-north-korea-escape-penalties?utm_source=rss_feed,"Russia left off because there was no meaningful trade with it, while Cuba, Belarus and North Korea were already heavily sanctioned.","Fri, 04 Apr 2025 17:21:52 +0800",Reuters,https://www.scmp.com/news/world/united-states-canada/article/3305253/trumps-tariffs-hit-allies-and-rivals-russia-cuba-and-north-korea-escape-penalties?utm_source=rss_feed,"Russia left off because there was no meaningful trade with it, while Cuba, Belarus and North Korea were already heavily sanctioned.",2025-04-04 17:21:52,
SCMP,news,asia,‘Thrill-seeking’ US tourist arrested after visit to India’s restricted North Sentinel Island,https://www.scmp.com/week-asia/people/article/3305252/thrill-seeking-us-tourist-arrested-after-visit-indias-restricted-north-sentinel-island?utm_source=rss_feed,Mykhailo Viktorovych Polyakov tried to make contact with the isolated Sentinelese tribe and left offerings on the island.,"Fri, 04 Apr 2025 17:20:18 +0800",SCMP’s Asia desk,https://www.scmp.com/week-asia/people/article/3305252/thrill-seeking-us-tourist-arrested-after-visit-indias-restricted-north-sentinel-island?utm_source=rss_feed,Mykhailo Viktorovych Polyakov tried to make contact with the isolated Sentinelese tribe and left offerings on the island.,2025-04-04 17:20:18,
SCMP,business,companies,China’s Zheng Qinwen joins call for tennis grand slam prize money to be shared more fairly,https://www.scmp.com/sport/tennis/article/3305251/chinas-zheng-qinwen-joins-call-tennis-grand-slam-prize-money-be-shared-more-fairly?utm_source=rss_feed,"While top players benefit from increased prize money, players at lower levels often struggle because of a lack of sponsorship and high costs.","Fri, 04 Apr 2025 17:19:54 +0800",Reuters,https://www.scmp.com/sport/tennis/article/3305251/chinas-zheng-qinwen-joins-call-tennis-grand-slam-prize-money-be-shared-more-fairly?utm_source=rss_feed,"While top players benefit from increased prize money, players at lower levels often struggle because of a lack of sponsorship and high costs.",2025-04-04 17:19:54,
SCMP,business,global_economy,"5 of the best things to do in Hong Kong this weekend April 5-7, from seeing film to ballet",https://www.scmp.com/lifestyle/health-wellness/article/3305208/5-best-things-do-hong-kong-weekend-april-5-7-film-ballet?utm_source=rss_feed,"From a brewery’s anniversary celebration to a ballet about Frida Kahlo to an Oscar-winning film, here are 5 things to check out this weekend.","Fri, 04 Apr 2025 17:15:08 +0800",SCMP Reporter,https://www.scmp.com/lifestyle/health-wellness/article/3305208/5-best-things-do-hong-kong-weekend-april-5-7-film-ballet?utm_source=rss_feed,"From a brewery’s anniversary celebration to a ballet about Frida Kahlo to an Oscar-winning film, here are 5 things to check out this weekend.",2025-04-04 17:15:08,
SCMP,news,china,US influencer IShowSpeed’s view of China makes him accidental ambassador,https://www.scmp.com/news/china/diplomacy/article/3305240/us-influencer-ishowspeeds-view-china-makes-him-accidental-ambassador?utm_source=rss_feed,The 20-year-old’s live streaming videos of his tour of Chinese cities win praise from analysts and government officials.,"Fri, 04 Apr 2025 17:02:07 +0800","Alyssa Chen,Danielle Popov",https://www.scmp.com/news/china/diplomacy/article/3305240/us-influencer-ishowspeeds-view-china-makes-him-accidental-ambassador?utm_source=rss_feed,The 20-year-old’s live streaming videos of his tour of Chinese cities win praise from analysts and government officials.,2025-04-04 17:02:07,
SCMP,news,world,"Police in Hong Kong, Singapore, 4 other jurisdictions, arrest 435 over child porn",https://www.scmp.com/news/hong-kong/law-and-crime/article/3305248/police-hong-kong-singapore-4-other-jurisdictions-arrest-435-child-porn-sting?utm_source=rss_feed,"Teenage boy who took pictures of younger sister among those charged locally after operation across East and Southeast Asia in February, March.","Fri, 04 Apr 2025 16:56:44 +0800",Jess Ma,https://www.scmp.com/news/hong-kong/law-and-crime/article/3305248/police-hong-kong-singapore-4-other-jurisdictions-arrest-435-child-porn-sting?utm_source=rss_feed,"Teenage boy who took pictures of younger sister among those charged locally after operation across East and Southeast Asia in February, March.",2025-04-04 16:56:44,
SCMP,business,companies,Record-breaking Romantic Warrior primed and ready to make more history at Meydan,https://www.scmp.com/sport/racing/article/3305239/record-breaking-romantic-warrior-primed-and-ready-make-more-history-meydan?utm_source=rss_feed,Danny Shum’s superstar chases a Hong Kong record 11th Group One win and a maiden Dubai Turf victory for the city.,"Fri, 04 Apr 2025 16:30:44 +0800",Sam Agars,https://www.scmp.com/sport/racing/article/3305239/record-breaking-romantic-warrior-primed-and-ready-make-more-history-meydan?utm_source=rss_feed,Danny Shum’s superstar chases a Hong Kong record 11th Group One win and a maiden Dubai Turf victory for the city.,2025-04-04 16:30:44,
SCMP,business,china_economy,Real threat posed by Trump’s tariffs worse than a global recession,https://www.scmp.com/opinion/world-opinion/article/3305104/real-threat-posed-trumps-tariffs-worse-global-recession?utm_source=rss_feed,The US president cannot be allowed to replace world’s hard-won multilateral compromise and cooperation with bullying bilateralism.,"Fri, 04 Apr 2025 16:30:08 +0800",David Dodwell,https://www.scmp.com/opinion/world-opinion/article/3305104/real-threat-posed-trumps-tariffs-worse-global-recession?utm_source=rss_feed,The US president cannot be allowed to replace world’s hard-won multilateral compromise and cooperation with bullying bilateralism.,2025-04-04 16:30:08,
SCMP,business,global_economy,MI5 reveals secrets and tools of real-life James Bonds throughout its history,https://www.scmp.com/lifestyle/entertainment/article/3305092/mi5-reveals-secrets-and-tools-real-life-james-bonds-throughout-its-history?utm_source=rss_feed,The intelligence agency’s exhibition at London’s National Archives delves into Britain’s history of spying and includes a 110-year-old lemon.,"Fri, 04 Apr 2025 16:15:08 +0800",Agencies,https://www.scmp.com/lifestyle/entertainment/article/3305092/mi5-reveals-secrets-and-tools-real-life-james-bonds-throughout-its-history?utm_source=rss_feed,The intelligence agency’s exhibition at London’s National Archives delves into Britain’s history of spying and includes a 110-year-old lemon.,2025-04-04 16:15:08,
SCMP,news,china,Chinese tourists plan stops to smell the cherry blossoms on holiday weekend,https://www.scmp.com/economy/china-economy/article/3305091/chinese-tourists-plan-stops-smell-cherry-blossoms-holiday-weekend?utm_source=rss_feed,"Ching Ming Festival trip bookings were up this year compared to last, travel platforms said, with particular interest in ‘flower tourism’.","Fri, 04 Apr 2025 16:00:08 +0800",Ralph Jennings,https://www.scmp.com/economy/china-economy/article/3305091/chinese-tourists-plan-stops-smell-cherry-blossoms-holiday-weekend?utm_source=rss_feed,"Ching Ming Festival trip bookings were up this year compared to last, travel platforms said, with particular interest in ‘flower tourism’.",2025-04-04 16:00:08,
SCMP,news,world,"Xia Baolong ‘concerned’ with Hong Kong’s tourism, as minister vows to do more",https://www.scmp.com/news/hong-kong/hong-kong-economy/article/3305223/xia-baolong-pushes-new-hong-kong-tourism-offerings-minister-eyes-islands-coasts?utm_source=rss_feed,Rosanna Law pledges to make the most of local resources in response to call from Beijing’s point man on Hong Kong affairs for new offerings.,"Fri, 04 Apr 2025 15:19:13 +0800",Cannix Yau,https://www.scmp.com/news/hong-kong/hong-kong-economy/article/3305223/xia-baolong-pushes-new-hong-kong-tourism-offerings-minister-eyes-islands-coasts?utm_source=rss_feed,Rosanna Law pledges to make the most of local resources in response to call from Beijing’s point man on Hong Kong affairs for new offerings.,2025-04-04 15:19:13,
SCMP,business,global_economy,"All about cloves, how to use them in cooking and a recipe that makes the most of them",https://www.scmp.com/lifestyle/food-drink/article/3304912/all-about-cloves-how-use-them-cooking-and-recipe-makes-most-them?utm_source=rss_feed,"Cloves, the immature flower bud of a tree, are used – whole or ground – in sweet and savoury dishes, to which they impart an intense flavour.","Fri, 04 Apr 2025 15:15:08 +0800",Susan Jung,https://www.scmp.com/lifestyle/food-drink/article/3304912/all-about-cloves-how-use-them-cooking-and-recipe-makes-most-them?utm_source=rss_feed,"Cloves, the immature flower bud of a tree, are used – whole or ground – in sweet and savoury dishes, to which they impart an intense flavour.",2025-04-04 15:15:08,
SCMP,business,business,Trump’s tariffs slam global markets in the biggest blow since the pandemic hit in 2020,https://www.scmp.com/business/markets/article/3305221/trumps-tariffs-slam-global-markets-biggest-blow-pandemic-hit-2020?utm_source=rss_feed,Some US$2.5 trillion was wiped out overnight in US markets after the S&P 500 and Nasdaq 100 sank by about 5 per cent.,"Fri, 04 Apr 2025 15:12:12 +0800","Associated Press,Bloomberg",https://www.scmp.com/business/markets/article/3305221/trumps-tariffs-slam-global-markets-biggest-blow-pandemic-hit-2020?utm_source=rss_feed,Some US$2.5 trillion was wiped out overnight in US markets after the S&P 500 and Nasdaq 100 sank by about 5 per cent.,2025-04-04 15:12:12,
SCMP,news,world,Hong Kong’s soon-to-open art-storage facility is another draw for family offices,https://www.scmp.com/business/banking-finance/article/3305067/hong-kongs-soon-open-art-storage-facility-another-draw-family-offices?utm_source=rss_feed,The complex at Skytopia airport city will be ready this year or early next year and enhance Hong Kong’s role as an art-trading centre.,"Fri, 04 Apr 2025 15:00:08 +0800",Enoch Yiu,https://www.scmp.com/business/banking-finance/article/3305067/hong-kongs-soon-open-art-storage-facility-another-draw-family-offices?utm_source=rss_feed,The complex at Skytopia airport city will be ready this year or early next year and enhance Hong Kong’s role as an art-trading centre.,2025-04-04 15:00:08,
SCMP,news,world,"Thousands in Hong Kong mark Ching Ming at cemeteries, over 470,000 leave for weekend",https://www.scmp.com/news/hong-kong/society/article/3305219/thousands-hong-kong-mark-ching-ming-cemeteries-over-150000-leave-weekend?utm_source=rss_feed,"About 473,000 residents have left city, while around 214,000 visitors have arrived.","Fri, 04 Apr 2025 14:46:16 +0800",Fiona Sun,https://www.scmp.com/news/hong-kong/society/article/3305219/thousands-hong-kong-mark-ching-ming-cemeteries-over-150000-leave-weekend?utm_source=rss_feed,"About 473,000 residents have left city, while around 214,000 visitors have arrived.",2025-04-04 14:46:16,
SCMP,news,asia,Tariffs for penguins? Trump trade order targets remote uninhabited Australian islands,https://www.scmp.com/week-asia/economics/article/3305217/tariffs-penguins-trump-trade-order-targets-remote-uninhabited-australian-islands?utm_source=rss_feed,"Critics are mocking Washington for placing tariffs on Heard Island and McDonald Islands, possibly due to mislabelled shipping data.","Fri, 04 Apr 2025 14:35:42 +0800",SCMP’s Asia desk,https://www.scmp.com/week-asia/economics/article/3305217/tariffs-penguins-trump-trade-order-targets-remote-uninhabited-australian-islands?utm_source=rss_feed,"Critics are mocking Washington for placing tariffs on Heard Island and McDonald Islands, possibly due to mislabelled shipping data.",2025-04-04 14:35:42,
SCMP,business,china_economy,Finland’s colossal underground bunkers a model for anxious Europe,https://www.scmp.com/news/world/europe/article/3305215/finlands-colossal-underground-bunkers-model-anxious-europe?utm_source=rss_feed,"With over 50,000 shelters, Finland’s defence strategy has attracted international interest since Russia invaded Ukraine.","Fri, 04 Apr 2025 14:28:52 +0800",Agence France-Presse,https://www.scmp.com/news/world/europe/article/3305215/finlands-colossal-underground-bunkers-model-anxious-europe?utm_source=rss_feed,"With over 50,000 shelters, Finland’s defence strategy has attracted international interest since Russia invaded Ukraine.",2025-04-04 14:28:52,
