source,category,subcategory,title,link,description,pub_date,author,guid,full_content,pub_date_formatted,full_paragraphs
SCMP,business,global_economy,Your Hong Kong weekend drinks guide for April 10-12,https://www.scmp.com/lifestyle/100-top-tables/article/3305792/your-hong-kong-weekend-drinks-guide-april-10-12?utm_source=rss_feed,"It’s guest shifts galore as The St. Regis Bar Hong Kong welcomes mixologists from sister properties, Quinary brings Prohibition-style drinks from Soko, and Bar Leone welcomes Toronto’s Bar Pompette.","Wed, 09 Apr 2025 18:15:11 +0800",Josiah Ng,https://www.scmp.com/lifestyle/100-top-tables/article/3305792/your-hong-kong-weekend-drinks-guide-april-10-12?utm_source=rss_feed,"It’s guest shifts galore as The St. Regis Bar Hong Kong welcomes mixologists from sister properties, Quinary brings Prohibition-style drinks from Soko, and Bar Leone welcomes Toronto’s Bar Pompette.",2025-04-09 18:15:11,
SCMP,business,global_economy,Fried chicken restaurant in Seoul satisfies Jollibee cravings with its fantastic dishes,https://www.scmp.com/lifestyle/food-drink/article/3305616/fried-chicken-restaurant-seoul-satisfies-jollibee-cravings-its-fantastic-dishes?utm_source=rss_feed,Members of Seoul’s Filipino community are lauding FRYb’s chicken dishes for giving them a taste of Jollibee nostaglia. We paid it a visit.,"Wed, 09 Apr 2025 18:15:08 +0800",The Korea Times,https://www.scmp.com/lifestyle/food-drink/article/3305616/fried-chicken-restaurant-seoul-satisfies-jollibee-cravings-its-fantastic-dishes?utm_source=rss_feed,Members of Seoul’s Filipino community are lauding FRYb’s chicken dishes for giving them a taste of Jollibee nostaglia. We paid it a visit.,2025-04-09 18:15:08,
SCMP,business,companies,Hong Kong Soccer Sevens: tough draw ‘great learning opportunity’ for young city side,https://www.scmp.com/sport/football/article/3305856/tough-hong-kong-soccer-sevens-group-great-learning-opportunity-young-city-team?utm_source=rss_feed,"Draw for three-day tournament places city’s under-22 team in a group with Leicester City, AZ Alkmaar and Football Club.","Wed, 09 Apr 2025 18:00:58 +0800",Paul McNamara,https://www.scmp.com/sport/football/article/3305856/tough-hong-kong-soccer-sevens-group-great-learning-opportunity-young-city-team?utm_source=rss_feed,"Draw for three-day tournament places city’s under-22 team in a group with Leicester City, AZ Alkmaar and Football Club.",2025-04-09 18:00:58,
SCMP,news,hong_kong,Alibaba executive sees ‘explosive growth’ in AI applications in China in 2025,https://www.scmp.com/tech/big-tech/article/3305840/alibaba-executive-sees-explosive-growth-ai-applications-china-2025?utm_source=rss_feed,A four-day AI fair hosted by Alibaba Cloud in Beijing offers visitors a glimpse of the future.,"Wed, 09 Apr 2025 18:00:43 +0800",Ben Jiang,https://www.scmp.com/tech/big-tech/article/3305840/alibaba-executive-sees-explosive-growth-ai-applications-china-2025?utm_source=rss_feed,A four-day AI fair hosted by Alibaba Cloud in Beijing offers visitors a glimpse of the future.,2025-04-09 18:00:43,
SCMP,news,hong_kong,WWII bomber base enlisted for US power projection against China in the Pacific,https://www.scmp.com/news/china/military/article/3305771/wwii-bomber-base-enlisted-us-power-projection-against-china-pacific?utm_source=rss_feed,Decades of jungle growth stripped away and multiple runways restored on abandoned airfield in the strategic second island chain.,"Wed, 09 Apr 2025 18:00:22 +0800","Liu Zhen,Sylvie Zhuang",https://www.scmp.com/news/china/military/article/3305771/wwii-bomber-base-enlisted-us-power-projection-against-china-pacific?utm_source=rss_feed,Decades of jungle growth stripped away and multiple runways restored on abandoned airfield in the strategic second island chain.,2025-04-09 18:00:22,
SCMP,news,hong_kong,"Chinese cancer patient holds park funeral for herself, gains support from passers-by",https://www.scmp.com/news/people-culture/trending-china/article/3305749/chinese-cancer-patient-holds-park-funeral-herself-gains-support-passers?utm_source=rss_feed,"‘I do not fear death. Life’s value is not in its duration, but in how fully we embrace each moment,’ says woman.","Wed, 09 Apr 2025 18:00:15 +0800",Zoey Zhang,https://www.scmp.com/news/people-culture/trending-china/article/3305749/chinese-cancer-patient-holds-park-funeral-herself-gains-support-passers?utm_source=rss_feed,"‘I do not fear death. Life’s value is not in its duration, but in how fully we embrace each moment,’ says woman.",2025-04-09 18:00:15,
SCMP,news,hong_kong,Malaysia’s brain drain deepens as 1 in 6 state-funded scholars opts to work abroad,https://www.scmp.com/week-asia/people/article/3305861/malaysias-brain-drain-deepens-1-6-state-funded-scholars-opts-work-abroad?utm_source=rss_feed,"Government data shows over 2,800 scholarship recipients have chosen not to return and fulfil their public service commitments since 2010.","Wed, 09 Apr 2025 17:53:27 +0800",Hadi Azmi,https://www.scmp.com/week-asia/people/article/3305861/malaysias-brain-drain-deepens-1-6-state-funded-scholars-opts-work-abroad?utm_source=rss_feed,"Government data shows over 2,800 scholarship recipients have chosen not to return and fulfil their public service commitments since 2010.",2025-04-09 17:53:27,
SCMP,news,hong_kong,Hong Kong and Ningxia autonomous region forge trade ties amid US-China tariff war,https://www.scmp.com/business/china-business/article/3305860/hong-kong-and-ningxia-autonomous-region-forge-trade-ties-amid-us-china-tariff-war?utm_source=rss_feed,Deals worth US$616 million were signed at the launch of the Ningxia-Hong Kong Cooperation Advisory Committee.,"Wed, 09 Apr 2025 17:53:23 +0800",Cao Li,https://www.scmp.com/business/china-business/article/3305860/hong-kong-and-ningxia-autonomous-region-forge-trade-ties-amid-us-china-tariff-war?utm_source=rss_feed,Deals worth US$616 million were signed at the launch of the Ningxia-Hong Kong Cooperation Advisory Committee.,2025-04-09 17:53:23,
SCMP,business,global_economy,Drop movie review: first date goes wrong in clumsy thriller by Happy Death Day director,https://www.scmp.com/lifestyle/entertainment/article/3305796/drop-movie-review-first-date-goes-wrong-clumsy-thriller-happy-death-day-director?utm_source=rss_feed,The White Lotus’ Meghann Fahy plays a widow on a first date who faces a terrifying quandary in Christopher Landon’s implausible film.,"Wed, 09 Apr 2025 17:45:07 +0800",James Marsh,https://www.scmp.com/lifestyle/entertainment/article/3305796/drop-movie-review-first-date-goes-wrong-clumsy-thriller-happy-death-day-director?utm_source=rss_feed,The White Lotus’ Meghann Fahy plays a widow on a first date who faces a terrifying quandary in Christopher Landon’s implausible film.,2025-04-09 17:45:07,
SCMP,news,hong_kong,Korean actress Kim Min-hee and film director Hong Sang-soo welcome baby boy,https://www.scmp.com/lifestyle/k-drama/artists-celebrities/article/3305859/korean-actress-kim-min-hee-and-film-director-hong-sang-soo-welcome-baby-boy?utm_source=rss_feed,"Actress, 43, who has been in relationship with filmmaker Hong Sang-soo, 65, for about a decade, gave birth at hospital in Hanam, South Korea.","Wed, 09 Apr 2025 17:42:13 +0800",The Korea Times,https://www.scmp.com/lifestyle/k-drama/artists-celebrities/article/3305859/korean-actress-kim-min-hee-and-film-director-hong-sang-soo-welcome-baby-boy?utm_source=rss_feed,"Actress, 43, who has been in relationship with filmmaker Hong Sang-soo, 65, for about a decade, gave birth at hospital in Hanam, South Korea.",2025-04-09 17:42:13,
SCMP,business,companies,Meet ONE Championship’s hydration king who helps elite fighters make weight,https://www.scmp.com/sport/martial-arts/article/3305853/meet-one-championships-hydration-king-who-helps-elite-fighters-make-weight?utm_source=rss_feed,"Peter Miller, known as the “Condition Nutrition”, has quickly become one of the most sought-after names in combat sports nutrition.","Wed, 09 Apr 2025 17:24:01 +0800",Andrew Whitelaw,https://www.scmp.com/sport/martial-arts/article/3305853/meet-one-championships-hydration-king-who-helps-elite-fighters-make-weight?utm_source=rss_feed,"Peter Miller, known as the “Condition Nutrition”, has quickly become one of the most sought-after names in combat sports nutrition.",2025-04-09 17:24:01,
SCMP,news,hong_kong,"Work with a smile? But that’s harassment, say nearly half of Japanese polled",https://www.scmp.com/week-asia/lifestyle-culture/article/3305850/work-smile-thats-harassment-say-nearly-half-japanese-polled?utm_source=rss_feed,"45.7 per cent of respondents say they think asking store staff to smile is harassment, suggesting growing sensitivity to pressures on service workers.","Wed, 09 Apr 2025 17:15:55 +0800",SCMP’s Asia desk,https://www.scmp.com/week-asia/lifestyle-culture/article/3305850/work-smile-thats-harassment-say-nearly-half-japanese-polled?utm_source=rss_feed,"45.7 per cent of respondents say they think asking store staff to smile is harassment, suggesting growing sensitivity to pressures on service workers.",2025-04-09 17:15:55,
SCMP,business,global_economy,Biggest David Hockney exhibition ever opens in Paris featuring around 400 artworks,https://www.scmp.com/lifestyle/arts/article/3305841/biggest-david-hockney-exhibition-ever-opens-paris-featuring-around-400-artworks?utm_source=rss_feed,"The Louis Vuitton Foundation show is a stunning tribute to one of the world’s bestselling living artists, and includes iPad creations.","Wed, 09 Apr 2025 17:15:07 +0800",Agence France-Presse,https://www.scmp.com/lifestyle/arts/article/3305841/biggest-david-hockney-exhibition-ever-opens-paris-featuring-around-400-artworks?utm_source=rss_feed,"The Louis Vuitton Foundation show is a stunning tribute to one of the world’s bestselling living artists, and includes iPad creations.",2025-04-09 17:15:07,
SCMP,news,hong_kong,MTR users urged to plan ahead with work reducing Tung Chung line Saturday night service,https://www.scmp.com/news/hong-kong/transport/article/3305844/mtr-users-urged-plan-ahead-work-reducing-tung-chung-line-saturday-night-service?utm_source=rss_feed,Rail operator says second of four devices to be installed overnight to connect track to planned Tung Chung East station.,"Wed, 09 Apr 2025 17:12:19 +0800",Ambrose Li,https://www.scmp.com/news/hong-kong/transport/article/3305844/mtr-users-urged-plan-ahead-work-reducing-tung-chung-line-saturday-night-service?utm_source=rss_feed,Rail operator says second of four devices to be installed overnight to connect track to planned Tung Chung East station.,2025-04-09 17:12:19,
SCMP,news,hong_kong,Chip war: Samsung denies halting foundry services for Chinese clients amid US pressure,https://www.scmp.com/tech/big-tech/article/3305813/chip-war-samsung-denies-halting-foundry-services-chinese-clients-amid-us-pressure?utm_source=rss_feed,Samsung operates one of the few foundries capable of rivalling industry-leading TSMC in producing advanced chips.,"Wed, 09 Apr 2025 17:00:08 +0800",Zhou Xin,https://www.scmp.com/tech/big-tech/article/3305813/chip-war-samsung-denies-halting-foundry-services-chinese-clients-amid-us-pressure?utm_source=rss_feed,Samsung operates one of the few foundries capable of rivalling industry-leading TSMC in producing advanced chips.,2025-04-09 17:00:08,
SCMP,news,hong_kong,Trump’s tariff wall was never about fairness or reciprocity,https://www.scmp.com/opinion/world-opinion/article/3305788/trumps-tariff-wall-was-never-about-fairness-or-reciprocity?utm_source=rss_feed,Blanket tariffs on all goods imports confirm he is committed to ‘liberating’ the US from the very system that made it prosperous.,"Wed, 09 Apr 2025 16:30:09 +0800",Ian Bremmer,https://www.scmp.com/opinion/world-opinion/article/3305788/trumps-tariff-wall-was-never-about-fairness-or-reciprocity?utm_source=rss_feed,Blanket tariffs on all goods imports confirm he is committed to ‘liberating’ the US from the very system that made it prosperous.,2025-04-09 16:30:09,
SCMP,news,hong_kong,Hong Kong lawmakers concerned over 52% rise in spending for coming Legco election,https://www.scmp.com/news/hong-kong/politics/article/3305837/hong-kong-lawmakers-concerned-over-52-increase-coming-legco-election-spending?utm_source=rss_feed,Constitutional affairs chief Erick Tsang defends additional resources while lawmakers question whether they will guarantee high voter turnout.,"Wed, 09 Apr 2025 16:29:23 +0800",Willa Wu,https://www.scmp.com/news/hong-kong/politics/article/3305837/hong-kong-lawmakers-concerned-over-52-increase-coming-legco-election-spending?utm_source=rss_feed,Constitutional affairs chief Erick Tsang defends additional resources while lawmakers question whether they will guarantee high voter turnout.,2025-04-09 16:29:23,
SCMP,news,hong_kong,Hong Kong’s first electric ferry service to run 3 days a week during non-rush hours,https://www.scmp.com/news/hong-kong/transport/article/3305835/hong-kongs-first-electric-ferry-service-run-3-days-week-during-non-rush-hours?utm_source=rss_feed,"Service between North Point and Hung Hom or Kowloon City tested with four daily trips, can offer 52 without recharging at full operation.","Wed, 09 Apr 2025 16:18:16 +0800",Edith Lin,https://www.scmp.com/news/hong-kong/transport/article/3305835/hong-kongs-first-electric-ferry-service-run-3-days-week-during-non-rush-hours?utm_source=rss_feed,"Service between North Point and Hung Hom or Kowloon City tested with four daily trips, can offer 52 without recharging at full operation.",2025-04-09 16:18:16,
SCMP,business,global_economy,She doesn’t have an inner voice. Her condition is so rare doctors don’t have a name for it,https://www.scmp.com/lifestyle/health-wellness/article/3305651/she-doesnt-have-inner-voice-her-condition-so-rare-doctors-dont-have-name-it?utm_source=rss_feed,"Most of us have an inner voice, some more than one. But to the surprise of some scientists, a few people do not – like Australian Mel May.","Wed, 09 Apr 2025 16:15:07 +0800",Agence France-Presse,https://www.scmp.com/lifestyle/health-wellness/article/3305651/she-doesnt-have-inner-voice-her-condition-so-rare-doctors-dont-have-name-it?utm_source=rss_feed,"Most of us have an inner voice, some more than one. But to the surprise of some scientists, a few people do not – like Australian Mel May.",2025-04-09 16:15:07,
SCMP,news,hong_kong,Chinese exporters said to be ditching shipments mid-voyage to avoid crushing Trump tariffs,https://www.scmp.com/economy/china-economy/article/3305834/chinese-exporters-said-be-ditching-shipments-mid-voyage-avoid-crushing-trump-tariffs?utm_source=rss_feed,"One export company’s US-bound container volume has plummeted, from 40 to 50 containers a day to just three to six.","Wed, 09 Apr 2025 16:10:06 +0800",Luna Sun,https://www.scmp.com/economy/china-economy/article/3305834/chinese-exporters-said-be-ditching-shipments-mid-voyage-avoid-crushing-trump-tariffs?utm_source=rss_feed,"One export company’s US-bound container volume has plummeted, from 40 to 50 containers a day to just three to six.",2025-04-09 16:10:06,
SCMP,news,hong_kong,US steps up competition against China with US$4.7 billion loan for Mozambique gas project,https://www.scmp.com/news/china/diplomacy/article/3305815/us-steps-competition-against-china-us47-billion-loan-mozambique-gas-project?utm_source=rss_feed,Lawyer sees contest for share of African markets a bigger motivator for US project financing than national security.,"Wed, 09 Apr 2025 16:00:10 +0800",Jevans Nyabiage,https://www.scmp.com/news/china/diplomacy/article/3305815/us-steps-competition-against-china-us47-billion-loan-mozambique-gas-project?utm_source=rss_feed,Lawyer sees contest for share of African markets a bigger motivator for US project financing than national security.,2025-04-09 16:00:10,
SCMP,business,business,Chinese defence stocks in play as Trump’s tariffs erase DeepSeek-fuelled gains,https://www.scmp.com/business/china-business/article/3305824/chinese-defence-stocks-play-trumps-tariffs-erase-deepseek-fuelled-gains?utm_source=rss_feed,"Military industry is providing stability against the backdrop of turbulence in global markets, Industrial Securities analyst Shi Kang says.","Wed, 09 Apr 2025 15:48:58 +0800",Zhang Shidong,https://www.scmp.com/business/china-business/article/3305824/chinese-defence-stocks-play-trumps-tariffs-erase-deepseek-fuelled-gains?utm_source=rss_feed,"Military industry is providing stability against the backdrop of turbulence in global markets, Industrial Securities analyst Shi Kang says.",2025-04-09 15:48:58,
SCMP,news,hong_kong,Trump’s ‘awful’ tariffs leave Italy’s luxury furniture sector scrambling to cushion blow,https://www.scmp.com/news/world/europe/article/3305821/trumps-awful-tariffs-leave-italys-luxury-furniture-sector-scrambling-cushion-blow?utm_source=rss_feed,"‘I will lose a lot of my clients. I think the tariffs are going to be enormously awful for trade,’ an interior designer says.","Wed, 09 Apr 2025 15:30:46 +0800",Agence France-Presse,https://www.scmp.com/news/world/europe/article/3305821/trumps-awful-tariffs-leave-italys-luxury-furniture-sector-scrambling-cushion-blow?utm_source=rss_feed,"‘I will lose a lot of my clients. I think the tariffs are going to be enormously awful for trade,’ an interior designer says.",2025-04-09 15:30:46,
SCMP,news,hong_kong,"2026 Venice Biennale’s Hong Kong show gets new organiser, with Museum of Art replacing M+",https://www.scmp.com/lifestyle/arts/article/3305807/2026-venice-biennales-hong-kong-show-gets-new-organiser-museum-art-replacing-m?utm_source=rss_feed,"Hong Kong Museum of Art, put in charge of arranging exhibition at world’s oldest art biennial in place of M+ museum, invites proposals.","Wed, 09 Apr 2025 15:15:08 +0800",Enid Tsui,https://www.scmp.com/lifestyle/arts/article/3305807/2026-venice-biennales-hong-kong-show-gets-new-organiser-museum-art-replacing-m?utm_source=rss_feed,"Hong Kong Museum of Art, put in charge of arranging exhibition at world’s oldest art biennial in place of M+ museum, invites proposals.",2025-04-09 15:15:08,
SCMP,news,hong_kong,‘More short-term measures needed to help Hong Kong SMEs amid Trump tariffs’,https://www.scmp.com/news/hong-kong/hong-kong-economy/article/3305817/more-short-term-measures-needed-help-hong-kong-smes-amid-trump-tariffs?utm_source=rss_feed,"Government adviser calls on banks to extend loan repayment terms by additional 12 months, as business leader urges ‘extraordinary intervention’.","Wed, 09 Apr 2025 15:14:46 +0800",Wynna Wong,https://www.scmp.com/news/hong-kong/hong-kong-economy/article/3305817/more-short-term-measures-needed-help-hong-kong-smes-amid-trump-tariffs?utm_source=rss_feed,"Government adviser calls on banks to extend loan repayment terms by additional 12 months, as business leader urges ‘extraordinary intervention’.",2025-04-09 15:14:46,
SCMP,news,hong_kong,Australia’s drone donation boosts Philippines’ maritime needs amid South China Sea tensions,https://www.scmp.com/week-asia/economics/article/3305816/australias-drone-donation-boosts-philippines-maritime-needs-amid-south-china-sea-tensions?utm_source=rss_feed,Australia’s gift comes days after a near-collision between Philippine and Chinese coastguard vessels in the South China Sea.,"Wed, 09 Apr 2025 15:05:58 +0800",Jeoffrey Maitem,https://www.scmp.com/week-asia/economics/article/3305816/australias-drone-donation-boosts-philippines-maritime-needs-amid-south-china-sea-tensions?utm_source=rss_feed,Australia’s gift comes days after a near-collision between Philippine and Chinese coastguard vessels in the South China Sea.,2025-04-09 15:05:58,
SCMP,news,hong_kong,‘Stop the stalking’: Japanese badminton star asks fans in China to keep distance,https://www.scmp.com/sport/china/article/3305814/stop-stalking-japanese-badminton-star-asks-fans-china-keep-distance?utm_source=rss_feed,"Chiharu Shida, dubbed ‘most beautiful badminton player’, says obsessive fans have left her feeling scared ‘every time we compete in China’.","Wed, 09 Apr 2025 15:05:18 +0800",Lars Hamer,https://www.scmp.com/sport/china/article/3305814/stop-stalking-japanese-badminton-star-asks-fans-china-keep-distance?utm_source=rss_feed,"Chiharu Shida, dubbed ‘most beautiful badminton player’, says obsessive fans have left her feeling scared ‘every time we compete in China’.",2025-04-09 15:05:18,
SCMP,news,hong_kong,"Gold slumps as Trump tariffs roil markets, but it remains a safe-haven choice: analysts",https://www.scmp.com/economy/china-economy/article/3305801/gold-slumps-trump-tariffs-roil-markets-it-remains-safe-haven-choice-analysts?utm_source=rss_feed,"Spot price climbed 40 per cent in a year, but it has now fallen 5.1% from peak in less than a week.","Wed, 09 Apr 2025 15:00:13 +0800",Fan Chen,https://www.scmp.com/economy/china-economy/article/3305801/gold-slumps-trump-tariffs-roil-markets-it-remains-safe-haven-choice-analysts?utm_source=rss_feed,"Spot price climbed 40 per cent in a year, but it has now fallen 5.1% from peak in less than a week.",2025-04-09 15:00:13,
SCMP,news,hong_kong,"China’s quest for cheaper cancer cure, Comac’s quiet supersonic jet: 7 science highlights",https://www.scmp.com/news/china/science/article/3305766/chinas-quest-cheaper-cancer-cure-comacs-quiet-supersonic-jet-7-science-highlights?utm_source=rss_feed,"From a search for a cheaper cancer cure to EV expert Xu Fuguo’s return to China, here are some highlights from SCMP’s recent science reporting.","Wed, 09 Apr 2025 15:00:09 +0800",SCMP,https://www.scmp.com/news/china/science/article/3305766/chinas-quest-cheaper-cancer-cure-comacs-quiet-supersonic-jet-7-science-highlights?utm_source=rss_feed,"From a search for a cheaper cancer cure to EV expert Xu Fuguo’s return to China, here are some highlights from SCMP’s recent science reporting.",2025-04-09 15:00:09,
SCMP,business,business,Smart cities and global ambitions put HK’s innovation drive in focus,https://www.scmp.com/presented/business/topics/reimagining-hk-through-tech/article/3305650/smart-cities-and-global-ambitions-put-hks-innovation-drive-focus?utm_source=rss_feed,"InnoEX and the Electronics Fair showcase how the city is bridging public service, corporate innovation and global collaboration","Wed, 09 Apr 2025 14:50:36 +0800",Advertising partner,https://www.scmp.com/presented/business/topics/reimagining-hk-through-tech/article/3305650/smart-cities-and-global-ambitions-put-hks-innovation-drive-focus?utm_source=rss_feed,"InnoEX and the Electronics Fair showcase how the city is bridging public service, corporate innovation and global collaboration",2025-04-09 14:50:36,
SCMP,news,hong_kong,US ‘alarmed’ at arrest of American academic in Thailand for alleged royal defamation,https://www.scmp.com/week-asia/politics/article/3305810/us-alarmed-arrest-american-academic-thailand-alleged-royal-defamation?utm_source=rss_feed,The US State Department said Paul Chambers’ arrest ‘reinforces long-standing concerns about the use of lèse-majesté laws in Thailand’.,"Wed, 09 Apr 2025 14:32:43 +0800",SCMP’s Asia desk,https://www.scmp.com/week-asia/politics/article/3305810/us-alarmed-arrest-american-academic-thailand-alleged-royal-defamation?utm_source=rss_feed,The US State Department said Paul Chambers’ arrest ‘reinforces long-standing concerns about the use of lèse-majesté laws in Thailand’.,2025-04-09 14:32:43,
SCMP,news,hong_kong,Xi Jinping vows to boost strategic ties with neighbours as trade war escalates,https://www.scmp.com/news/china/diplomacy/article/3305809/china-strengthen-strategic-ties-neighbours-xi-jinping-says?utm_source=rss_feed,"In latest sign of renewed focus on neighbourhood, Chinese leader says region will strengthen bonds by ‘appropriately’ managing differences.","Wed, 09 Apr 2025 14:32:28 +0800","Orange Wang,Dewey Sim",https://www.scmp.com/news/china/diplomacy/article/3305809/china-strengthen-strategic-ties-neighbours-xi-jinping-says?utm_source=rss_feed,"In latest sign of renewed focus on neighbourhood, Chinese leader says region will strengthen bonds by ‘appropriately’ managing differences.",2025-04-09 14:32:28,
SCMP,news,hong_kong,Hong Kong to adjust HK$2 transport subsidy scheme starting in April 2026,https://www.scmp.com/news/hong-kong/society/article/3305808/hong-kong-impose-new-pricing-model-hk2-transport-scheme-april-2026?utm_source=rss_feed,"Minister says authorities to implement part of revised scheme five months ahead of schedule, helping government to save HK$260 million.","Wed, 09 Apr 2025 14:29:18 +0800",Fiona Sun,https://www.scmp.com/news/hong-kong/society/article/3305808/hong-kong-impose-new-pricing-model-hk2-transport-scheme-april-2026?utm_source=rss_feed,"Minister says authorities to implement part of revised scheme five months ahead of schedule, helping government to save HK$260 million.",2025-04-09 14:29:18,
SCMP,news,hong_kong,Hong Kong court jails social worker for over 3½ years in retrial on rioting,https://www.scmp.com/news/hong-kong/politics/article/3305806/hong-kong-court-jails-social-worker-over-3-1/2-years-retrial-over-rioting?utm_source=rss_feed,Jackie Chen gets 10-month discount in acknowledgement of lengthy legal proceedings.,"Wed, 09 Apr 2025 14:19:04 +0800",Fiona Chow,https://www.scmp.com/news/hong-kong/politics/article/3305806/hong-kong-court-jails-social-worker-over-3-1/2-years-retrial-over-rioting?utm_source=rss_feed,Jackie Chen gets 10-month discount in acknowledgement of lengthy legal proceedings.,2025-04-09 14:19:04,
