source,category,subcategory,title,link,description,pub_date,author,guid,full_content,pub_date_formatted,full_paragraphs
SCMP,business,global_economy,How AI meal planning can help you prepare healthy food with minimal fuss,https://www.scmp.com/lifestyle/health-wellness/article/3305454/how-ai-meal-planning-can-help-you-prepare-healthy-food-minimal-fuss?utm_source=rss_feed,You’ve got the ingredients but what to prepare for you or your family? Free AI meal planning generators and apps can help get recipes.,"Mon, 07 Apr 2025 19:15:07 +0800",Tribune News Service,https://www.scmp.com/lifestyle/health-wellness/article/3305454/how-ai-meal-planning-can-help-you-prepare-healthy-food-minimal-fuss?utm_source=rss_feed,You’ve got the ingredients but what to prepare for you or your family? Free AI meal planning generators and apps can help get recipes.,2025-04-07 19:15:07,
SCMP,news,hong_kong,Ukraine war: Russia’s Putin says ceasefire ‘questions’ linger amid Kyiv-US minerals deal talks,https://www.scmp.com/news/world/russia-central-asia/article/3305544/ukraine-war-russias-putin-says-ceasefire-questions-linger-amid-us-minerals-deal-talks?utm_source=rss_feed,"US President Donald Trump has voiced frustration at the slow pace of talks, telling NBC news in March that he was “p***ed off” with Russia’s Vladimir Putin.","Mon, 07 Apr 2025 19:08:36 +0800",Agence France-Presse,https://www.scmp.com/news/world/russia-central-asia/article/3305544/ukraine-war-russias-putin-says-ceasefire-questions-linger-amid-us-minerals-deal-talks?utm_source=rss_feed,"US President Donald Trump has voiced frustration at the slow pace of talks, telling NBC news in March that he was “p***ed off” with Russia’s Vladimir Putin.",2025-04-07 19:08:36,
SCMP,news,hong_kong,"Beijing tells US firms to blame Washington for ‘tariff tensions’, hails China prospects",https://www.scmp.com/economy/global-economy/article/3305543/beijing-tells-us-firms-blame-washington-tariff-tensions-hails-china-prospects?utm_source=rss_feed,"‘Tariff tensions originate from Washington, and we encourage US businesses to address root causes,’ China’s vice-minister of commerce says in latest round-table chat.","Mon, 07 Apr 2025 19:07:03 +0800","Alice Li,Kandy Wong",https://www.scmp.com/economy/global-economy/article/3305543/beijing-tells-us-firms-blame-washington-tariff-tensions-hails-china-prospects?utm_source=rss_feed,"‘Tariff tensions originate from Washington, and we encourage US businesses to address root causes,’ China’s vice-minister of commerce says in latest round-table chat.",2025-04-07 19:07:03,
SCMP,business,companies,Russian leader Vladimir Putin congratulates NHL icon Alexander Ovechkin on goal record,https://www.scmp.com/sport/other-sport/article/3305540/russian-leader-vladimir-putin-congratulates-nhl-icon-alexander-ovechkin-goal-record?utm_source=rss_feed,"The 39-year-old Russian star, who plays for the Washington Capitals, on Sunday broke a record that had stood for 26 years at a New York arena.","Mon, 07 Apr 2025 19:00:23 +0800",Agence France-Presse,https://www.scmp.com/sport/other-sport/article/3305540/russian-leader-vladimir-putin-congratulates-nhl-icon-alexander-ovechkin-goal-record?utm_source=rss_feed,"The 39-year-old Russian star, who plays for the Washington Capitals, on Sunday broke a record that had stood for 26 years at a New York arena.",2025-04-07 19:00:23,
SCMP,news,hong_kong,"From Wall Street’s ‘Black Thursday’ to Covid-19, how Trump’s tariffs compare to worst crashes",https://www.scmp.com/news/world/united-states-canada/article/3305541/wall-streets-black-thursday-covid-19-how-trumps-tariffs-compare-worst-crashes?utm_source=rss_feed,"China’s retaliation to Trump’s tariffs caused historic stock market collapses in Asia and Europe, reminiscent of past financial crises.","Mon, 07 Apr 2025 18:40:22 +0800",Agence France-Presse,https://www.scmp.com/news/world/united-states-canada/article/3305541/wall-streets-black-thursday-covid-19-how-trumps-tariffs-compare-worst-crashes?utm_source=rss_feed,"China’s retaliation to Trump’s tariffs caused historic stock market collapses in Asia and Europe, reminiscent of past financial crises.",2025-04-07 18:40:22,
SCMP,business,business,"Lawmakers urge Hong Kong stock exchange to speed up reforms, sharpen edge",https://www.scmp.com/business/article/3305539/lawmakers-urge-hong-kong-stock-exchange-speed-reforms-sharpen-edge?utm_source=rss_feed,"The volatility of global markets may provide new opportunities for IPOs in Hong Kong, a lawmaker says.","Mon, 07 Apr 2025 18:38:37 +0800",Enoch Yiu,https://www.scmp.com/business/article/3305539/lawmakers-urge-hong-kong-stock-exchange-speed-reforms-sharpen-edge?utm_source=rss_feed,"The volatility of global markets may provide new opportunities for IPOs in Hong Kong, a lawmaker says.",2025-04-07 18:38:37,
SCMP,news,hong_kong,Hong Kong live streams first court hearing under pilot scheme,https://www.scmp.com/news/hong-kong/law-and-crime/article/3305536/hong-kong-live-streams-first-court-hearing-under-pilot-scheme?utm_source=rss_feed,"Scheme, which starts this month, seeks to formalise broadcast arrangement, increase transparency, bolster public trust in judicial process.","Mon, 07 Apr 2025 18:29:02 +0800",Brian Wong,https://www.scmp.com/news/hong-kong/law-and-crime/article/3305536/hong-kong-live-streams-first-court-hearing-under-pilot-scheme?utm_source=rss_feed,"Scheme, which starts this month, seeks to formalise broadcast arrangement, increase transparency, bolster public trust in judicial process.",2025-04-07 18:29:02,
SCMP,news,hong_kong,China’s central bank plans to name money launderers to curb financial crimes,https://www.scmp.com/economy/china-economy/article/3305535/chinas-central-bank-plans-name-money-launderers-curb-financial-crimes?utm_source=rss_feed,The People’s Bank of China has added a column to its website listing entities at high risk for money laundering in advance of an international review.,"Mon, 07 Apr 2025 18:19:40 +0800",Luna Sun,https://www.scmp.com/economy/china-economy/article/3305535/chinas-central-bank-plans-name-money-launderers-curb-financial-crimes?utm_source=rss_feed,The People’s Bank of China has added a column to its website listing entities at high risk for money laundering in advance of an international review.,2025-04-07 18:19:40,
SCMP,business,business,"Golden seal from Korean kingdom sells in Hong Kong for US$1.39 million, 9 times estimate",https://www.scmp.com/lifestyle/arts/article/3305517/golden-seal-korean-kingdom-sells-hong-kong-us139-million-9-times-estimate?utm_source=rss_feed,Record-setting price paid for seal given by China’s Jin dynasty to a nobleman of Korea’s Goguryeo kingdom in China Guardian’s Hong Kong sale.,"Mon, 07 Apr 2025 18:15:07 +0800",The Korea Times,https://www.scmp.com/lifestyle/arts/article/3305517/golden-seal-korean-kingdom-sells-hong-kong-us139-million-9-times-estimate?utm_source=rss_feed,Record-setting price paid for seal given by China’s Jin dynasty to a nobleman of Korea’s Goguryeo kingdom in China Guardian’s Hong Kong sale.,2025-04-07 18:15:07,
SCMP,news,hong_kong,"Why do South Korean celebrities reveal divorces years later, despite shifting social views?",https://www.scmp.com/news/asia/east-asia/article/3305534/why-do-south-korean-celebrities-reveal-divorces-years-later-despite-shifting-social-views?utm_source=rss_feed,"More South Korean stars are revealing their divorces years later, balancing privacy, public image, and societal expectations amid evolving attitudes.","Mon, 07 Apr 2025 18:13:27 +0800",The Korea Times,https://www.scmp.com/news/asia/east-asia/article/3305534/why-do-south-korean-celebrities-reveal-divorces-years-later-despite-shifting-social-views?utm_source=rss_feed,"More South Korean stars are revealing their divorces years later, balancing privacy, public image, and societal expectations amid evolving attitudes.",2025-04-07 18:13:27,
SCMP,news,hong_kong,Japanese bar district gets bilingual wristbands to gauge revellers’ mood,https://www.scmp.com/week-asia/lifestyle-culture/article/3305532/japanese-bar-district-gets-bilingual-wristbands-gauge-revellers-mood?utm_source=rss_feed,"Six colour-coded wristbands help drinkers start or avoid conversations in Noge, a neighbourhood in Yokohama dotted with bars and pubs.","Mon, 07 Apr 2025 18:10:06 +0800",SCMP’s Asia desk,https://www.scmp.com/week-asia/lifestyle-culture/article/3305532/japanese-bar-district-gets-bilingual-wristbands-gauge-revellers-mood?utm_source=rss_feed,"Six colour-coded wristbands help drinkers start or avoid conversations in Noge, a neighbourhood in Yokohama dotted with bars and pubs.",2025-04-07 18:10:06,
SCMP,news,hong_kong,Finance chief says ‘no drastic measures’ needed despite volatility – as it happened,https://www.scmp.com/news/hong-kong/hong-kong-economy/article/3305531/hong-kong-finance-chief-paul-chan-meet-press-after-stock-market-rout?utm_source=rss_feed,"Benchmark Hang Seng Index suffers its largest single-day loss since 1997, falling 3,021 points to 19,828, sparked by fears over effects of Trump’s tariffs.","Mon, 07 Apr 2025 18:09:52 +0800",SCMP Reporters,https://www.scmp.com/news/hong-kong/hong-kong-economy/article/3305531/hong-kong-finance-chief-paul-chan-meet-press-after-stock-market-rout?utm_source=rss_feed,"Benchmark Hang Seng Index suffers its largest single-day loss since 1997, falling 3,021 points to 19,828, sparked by fears over effects of Trump’s tariffs.",2025-04-07 18:09:52,
SCMP,news,hong_kong,Top China think tank shuts down research centre after questions of party loyalty,https://www.scmp.com/news/china/politics/article/3305501/top-china-think-tank-shuts-down-research-centre-after-questions-party-loyalty?utm_source=rss_feed,"Chinese Academy of Social Sciences abolishes entity, warns any activities carried out in its name would be illegal.","Mon, 07 Apr 2025 18:01:00 +0800",Yuanyue Dang,https://www.scmp.com/news/china/politics/article/3305501/top-china-think-tank-shuts-down-research-centre-after-questions-party-loyalty?utm_source=rss_feed,"Chinese Academy of Social Sciences abolishes entity, warns any activities carried out in its name would be illegal.",2025-04-07 18:01:00,
SCMP,news,hong_kong,China love guru who teaches women how to marry rich faces US$1 million tax evasion fine,https://www.scmp.com/news/people-culture/china-personalities/article/3305085/china-love-guru-who-teaches-women-how-marry-rich-faces-us1-million-tax-evasion-fine?utm_source=rss_feed,"Self-styled ‘McKinsey of relationships’ teaches that relationships, marriage are strategic tools for climbing social, financial ladder.","Mon, 07 Apr 2025 18:00:08 +0800",Yating Yang,https://www.scmp.com/news/people-culture/china-personalities/article/3305085/china-love-guru-who-teaches-women-how-marry-rich-faces-us1-million-tax-evasion-fine?utm_source=rss_feed,"Self-styled ‘McKinsey of relationships’ teaches that relationships, marriage are strategic tools for climbing social, financial ladder.",2025-04-07 18:00:08,
SCMP,business,companies,Romantic Warrior tired but healthy as he awaits Hong Kong return,https://www.scmp.com/sport/racing/article/3305530/romantic-warrior-tired-healthy-he-awaits-hong-kong-return?utm_source=rss_feed,"Danny Shum’s champion pulls up well from his shock defeat in Saturday night’s Group One Dubai Turf (1,800m) at Meydan.","Mon, 07 Apr 2025 17:54:53 +0800",Sam Agars,https://www.scmp.com/sport/racing/article/3305530/romantic-warrior-tired-healthy-he-awaits-hong-kong-return?utm_source=rss_feed,"Danny Shum’s champion pulls up well from his shock defeat in Saturday night’s Group One Dubai Turf (1,800m) at Meydan.",2025-04-07 17:54:53,
SCMP,business,companies,ONE Championship: Rodtang hints fight with Haggerty on under ‘any rules’,https://www.scmp.com/sport/martial-arts/article/3305525/one-championship-rodtang-hints-fight-haggerty-under-any-rules?utm_source=rss_feed,Thai fighter listed Briton as one of three dream fights to potentially close his career with in Instagram post.,"Mon, 07 Apr 2025 17:49:10 +0800",Andrew Whitelaw,https://www.scmp.com/sport/martial-arts/article/3305525/one-championship-rodtang-hints-fight-haggerty-under-any-rules?utm_source=rss_feed,Thai fighter listed Briton as one of three dream fights to potentially close his career with in Instagram post.,2025-04-07 17:49:10,
SCMP,news,hong_kong,Malaysia warns of slowdown over US tariff as visit by China’s Xi raises trade hopes,https://www.scmp.com/week-asia/economics/article/3305523/malaysia-warns-slowdown-over-us-tariff-china-xis-visit-raises-trade-hopes?utm_source=rss_feed,"President Xi Jinping’s coming visit to Malaysia, Cambodia and Vietnam has turned attention to China as a potential economic stabiliser.","Mon, 07 Apr 2025 17:46:46 +0800",Joseph Sipalan,https://www.scmp.com/week-asia/economics/article/3305523/malaysia-warns-slowdown-over-us-tariff-china-xis-visit-raises-trade-hopes?utm_source=rss_feed,"President Xi Jinping’s coming visit to Malaysia, Cambodia and Vietnam has turned attention to China as a potential economic stabiliser.",2025-04-07 17:46:46,
SCMP,tech,tech,Apple supplier Luxshare says diversification strategy will mitigate impact of Trump tariffs,https://www.scmp.com/tech/tech-war/article/3305507/apple-supplier-luxshare-says-diversification-strategy-will-mitigate-impact-trump-tariffs?utm_source=rss_feed,"A total of 157 contractors in mainland China provide Apple with parts or manufacturing, according to the company’s latest supplier list.","Mon, 07 Apr 2025 17:30:08 +0800",Ben Jiang,https://www.scmp.com/tech/tech-war/article/3305507/apple-supplier-luxshare-says-diversification-strategy-will-mitigate-impact-trump-tariffs?utm_source=rss_feed,"A total of 157 contractors in mainland China provide Apple with parts or manufacturing, according to the company’s latest supplier list.",2025-04-07 17:30:08,
SCMP,business,global_economy,"Hong Kong Ballet’s Frida is a visually powerful production, if lacking in clarity",https://www.scmp.com/lifestyle/arts/article/3305486/hong-kong-ballets-frida-visually-powerful-production-if-lacking-clarity?utm_source=rss_feed,"Ballet adapted from one-act work shows vignettes of artist Frida Kahlo’s life, with striking choreography and costumes, but feels stretched.","Mon, 07 Apr 2025 17:15:07 +0800",Natasha Rogai,https://www.scmp.com/lifestyle/arts/article/3305486/hong-kong-ballets-frida-visually-powerful-production-if-lacking-clarity?utm_source=rss_feed,"Ballet adapted from one-act work shows vignettes of artist Frida Kahlo’s life, with striking choreography and costumes, but feels stretched.",2025-04-07 17:15:07,
SCMP,news,hong_kong,Bangkok residents rethink high-rise living after Myanmar quake: ‘I feel scared’,https://www.scmp.com/news/asia/southeast-asia/article/3305514/bangkok-residents-rethink-high-rise-living-after-myanmar-quake-i-feel-scared?utm_source=rss_feed,"One property manager said the quake prompted a flurry of inquiries from residents looking to relocate, due to ‘fear and anxiety’ of living far above ground.","Mon, 07 Apr 2025 17:08:24 +0800",Agence France-Presse,https://www.scmp.com/news/asia/southeast-asia/article/3305514/bangkok-residents-rethink-high-rise-living-after-myanmar-quake-i-feel-scared?utm_source=rss_feed,"One property manager said the quake prompted a flurry of inquiries from residents looking to relocate, due to ‘fear and anxiety’ of living far above ground.",2025-04-07 17:08:24,
SCMP,news,hong_kong,"After delay, new Chinese funding plan will help extend railway to Uganda, Kenya says",https://www.scmp.com/news/china/diplomacy/article/3305483/after-delay-new-chinese-funding-plan-will-help-extend-railway-uganda-kenya-says?utm_source=rss_feed,"Mineral-rich Democratic Republic of Congo is China’s ‘pot of gold’ at the end of the Standard Gauge Railway, analyst says.","Mon, 07 Apr 2025 17:00:08 +0800",Jevans Nyabiage,https://www.scmp.com/news/china/diplomacy/article/3305483/after-delay-new-chinese-funding-plan-will-help-extend-railway-uganda-kenya-says?utm_source=rss_feed,"Mineral-rich Democratic Republic of Congo is China’s ‘pot of gold’ at the end of the Standard Gauge Railway, analyst says.",2025-04-07 17:00:08,
SCMP,news,hong_kong,Second headless pygmy elephant corpse discovery in Malaysia raises fears of ivory poaching,https://www.scmp.com/week-asia/health-environment/article/3305506/second-headless-pygmy-elephant-corpse-discovery-malaysia-raises-fears-ivory-poaching?utm_source=rss_feed,"The practice of giving tusks as dowry in neighbouring Indonesia may be behind the killings, conservationists say.","Mon, 07 Apr 2025 16:46:32 +0800",Hadi Azmi,https://www.scmp.com/week-asia/health-environment/article/3305506/second-headless-pygmy-elephant-corpse-discovery-malaysia-raises-fears-ivory-poaching?utm_source=rss_feed,"The practice of giving tusks as dowry in neighbouring Indonesia may be behind the killings, conservationists say.",2025-04-07 16:46:32,
SCMP,news,hong_kong,Myanmar junta leader Min Aung Hlaing visits quake epicentre – 10 days after disaster,https://www.scmp.com/week-asia/health-environment/article/3305504/myanmar-junta-leader-min-aung-hlaing-visits-quake-epicentre-10-days-after-disaster?utm_source=rss_feed,"Min Aung Hlaing’s visit reportedly hints at prioritisation of relief to religious institutions in Sagaing, where aid workers say supplies have been blocked.","Mon, 07 Apr 2025 16:42:58 +0800",Aidan Jones,https://www.scmp.com/week-asia/health-environment/article/3305504/myanmar-junta-leader-min-aung-hlaing-visits-quake-epicentre-10-days-after-disaster?utm_source=rss_feed,"Min Aung Hlaing’s visit reportedly hints at prioritisation of relief to religious institutions in Sagaing, where aid workers say supplies have been blocked.",2025-04-07 16:42:58,
SCMP,news,hong_kong,Why China is pivoting to Africa for copper,https://www.scmp.com/opinion/china-opinion/article/3305016/why-china-pivoting-africa-copper?utm_source=rss_feed,"Once a quiet workhorse of industry, copper has become a geopolitical flashpoint in the race for clean energy dominance.","Mon, 07 Apr 2025 16:30:09 +0800",Chenjie Song,https://www.scmp.com/opinion/china-opinion/article/3305016/why-china-pivoting-africa-copper?utm_source=rss_feed,"Once a quiet workhorse of industry, copper has become a geopolitical flashpoint in the race for clean energy dominance.",2025-04-07 16:30:09,
SCMP,business,global_economy,"Why fungal diseases, fuelled by climate change, may be the next global health threat",https://www.scmp.com/lifestyle/health-wellness/article/3305464/why-fungal-diseases-fuelled-climate-change-may-be-next-global-health-threat?utm_source=rss_feed,"Dangerous fungal infections that kill millions are becoming more common as the planet warms, and treatment options are few and far between.","Mon, 07 Apr 2025 16:15:06 +0800",Bloomberg,https://www.scmp.com/lifestyle/health-wellness/article/3305464/why-fungal-diseases-fuelled-climate-change-may-be-next-global-health-threat?utm_source=rss_feed,"Dangerous fungal infections that kill millions are becoming more common as the planet warms, and treatment options are few and far between.",2025-04-07 16:15:06,
SCMP,business,companies,Andrea Atzeni keen to keep the ball rolling with ‘nice book of rides’ at Happy Valley,https://www.scmp.com/sport/racing/article/3305495/andrea-atzeni-keen-keep-ball-rolling-nice-book-rides-happy-valley?utm_source=rss_feed,Sardinian jockey will look to add to his 38 winners for the campaign on Wednesday night.,"Mon, 07 Apr 2025 16:08:13 +0800",Sam Agars,https://www.scmp.com/sport/racing/article/3305495/andrea-atzeni-keen-keep-ball-rolling-nice-book-rides-happy-valley?utm_source=rss_feed,Sardinian jockey will look to add to his 38 winners for the campaign on Wednesday night.,2025-04-07 16:08:13,
SCMP,news,hong_kong,"‘The sky will not fall’: China urges unity, resilience as US trade tensions soar",https://www.scmp.com/news/china/diplomacy/article/3305493/sky-will-not-fall-china-urges-unity-resilience-us-trade-tensions-soar?utm_source=rss_feed,"People’s Daily commentary encourages nation to ‘weather storms’, assures country is prepared to counter Trump’s tariffs with ‘extraordinary’ measures.","Mon, 07 Apr 2025 16:01:07 +0800",Orange Wang,https://www.scmp.com/news/china/diplomacy/article/3305493/sky-will-not-fall-china-urges-unity-resilience-us-trade-tensions-soar?utm_source=rss_feed,"People’s Daily commentary encourages nation to ‘weather storms’, assures country is prepared to counter Trump’s tariffs with ‘extraordinary’ measures.",2025-04-07 16:01:07,
SCMP,news,hong_kong,"Central Huijin, a unit of China’s US$1.2 trillion wealth fund, buys ETFs to boost stocks",https://www.scmp.com/business/china-business/article/3305494/central-huijin-unit-chinas-us12-trillion-wealth-fund-buys-etfs-boost-stocks?utm_source=rss_feed,The company says it will make more such investments in the future to ‘resolutely’ maintain the stability of the capital market.,"Mon, 07 Apr 2025 16:00:30 +0800",Zhang Shidong,https://www.scmp.com/business/china-business/article/3305494/central-huijin-unit-chinas-us12-trillion-wealth-fund-buys-etfs-boost-stocks?utm_source=rss_feed,The company says it will make more such investments in the future to ‘resolutely’ maintain the stability of the capital market.,2025-04-07 16:00:30,
SCMP,business,business,"BYD Electronic, Lenovo sink over 20% as Trump tariffs hit exporters, equity markets",https://www.scmp.com/business/china-business/article/3305492/byd-electronic-lenovo-sink-20-trump-tariffs-hit-exporters-equity-markets?utm_source=rss_feed,"A 10 per cent tariff on exports could eat into China’s economic growth, putting Beijing’s 4.5 per cent target at risk, Morgan Stanley says.","Mon, 07 Apr 2025 15:50:47 +0800",Zhang Shidong,https://www.scmp.com/business/china-business/article/3305492/byd-electronic-lenovo-sink-20-trump-tariffs-hit-exporters-equity-markets?utm_source=rss_feed,"A 10 per cent tariff on exports could eat into China’s economic growth, putting Beijing’s 4.5 per cent target at risk, Morgan Stanley says.",2025-04-07 15:50:47,
SCMP,news,hong_kong,Southeast Asia’s balancing act with China threatened by Western aid cuts,https://www.scmp.com/week-asia/politics/article/3305487/southeast-asias-balancing-act-china-threatened-western-aid-cuts?utm_source=rss_feed,"Countries reliant on Chinese development support will have less room to diversify their ties given the aid cuts, a study shows.","Mon, 07 Apr 2025 15:36:25 +0800",Sam Beltran,https://www.scmp.com/week-asia/politics/article/3305487/southeast-asias-balancing-act-china-threatened-western-aid-cuts?utm_source=rss_feed,"Countries reliant on Chinese development support will have less room to diversify their ties given the aid cuts, a study shows.",2025-04-07 15:36:25,
SCMP,news,hong_kong,‘Sleepwalking’ Malaysian crane climber claims whispering voice led him to top,https://www.scmp.com/news/asia/southeast-asia/article/3305485/sleepwalking-malaysian-crane-climber-claims-whispering-voice-led-him-top?utm_source=rss_feed,Baffled onlookers watched as the man walked along the crane’s beam more than 120 metres above the ground before he was coaxed down.,"Mon, 07 Apr 2025 15:21:41 +0800",The Star,https://www.scmp.com/news/asia/southeast-asia/article/3305485/sleepwalking-malaysian-crane-climber-claims-whispering-voice-led-him-top?utm_source=rss_feed,Baffled onlookers watched as the man walked along the crane’s beam more than 120 metres above the ground before he was coaxed down.,2025-04-07 15:21:41,
SCMP,news,hong_kong,"Martial art you’ve probably never heard of, Madagascar’s Moraingy, seeks recognition",https://www.scmp.com/lifestyle/entertainment/article/3305482/martial-art-youve-probably-never-heard-madagascars-moraingy-seeks-recognition?utm_source=rss_feed,"In Moraingy, combat sport with a 400-year history in Madagascar, Africa, there are no rules. A fan of the martial art hopes to change that.","Mon, 07 Apr 2025 15:17:12 +0800",Agence France-Presse,https://www.scmp.com/lifestyle/entertainment/article/3305482/martial-art-youve-probably-never-heard-madagascars-moraingy-seeks-recognition?utm_source=rss_feed,"In Moraingy, combat sport with a 400-year history in Madagascar, Africa, there are no rules. A fan of the martial art hopes to change that.",2025-04-07 15:17:12,
SCMP,business,companies,China clean up at WTT Champions Incheon but Sun Yingsha warns of rising Japanese threat,https://www.scmp.com/sport/china/article/3305477/china-clean-wtt-champions-incheon-sun-yingsha-warns-rising-japanese-threat?utm_source=rss_feed,Chinese world No 1 says many young Japanese table tennis players are coming up through the ranks and urges Team China to ‘study them more’.,"Mon, 07 Apr 2025 15:00:09 +0800",Mike Chan,https://www.scmp.com/sport/china/article/3305477/china-clean-wtt-champions-incheon-sun-yingsha-warns-rising-japanese-threat?utm_source=rss_feed,Chinese world No 1 says many young Japanese table tennis players are coming up through the ranks and urges Team China to ‘study them more’.,2025-04-07 15:00:09,
SCMP,news,hong_kong,Singapore’s leaders warn over Trump tariff bombshell: ‘It’s not good news’,https://www.scmp.com/news/asia/southeast-asia/article/3305481/singapores-leaders-warn-over-trump-tariff-bombshell-its-not-good-news?utm_source=rss_feed,"PM Lawrence Wong warned of a rising global trade war threat, as his predecessor Lee Hsien Loong predicted long-term tariff fallout.","Mon, 07 Apr 2025 14:49:49 +0800",Bloomberg,https://www.scmp.com/news/asia/southeast-asia/article/3305481/singapores-leaders-warn-over-trump-tariff-bombshell-its-not-good-news?utm_source=rss_feed,"PM Lawrence Wong warned of a rising global trade war threat, as his predecessor Lee Hsien Loong predicted long-term tariff fallout.",2025-04-07 14:49:49,
